Name,URL
"2021 Newest HP Chromebook 11.6 Inch HD Laptop, MediaTek MT8183 8-core Processor, 4GB RAM, 32GB eMMC SSD, WiFi, Bluetooth, Webcam, Ash Gray, Chrome OS + Oydisen Cloth",http://www.amazon.com/HP-Chromebook-MediaTek-Processor-Bluetooth/dp/B08Q8174FS/ref=sr_1_1150?dchild=1&keywords=laptop&qid=1634625468&refinements=p_n_condition-type%3A2224371011&rnid=2224369011&s=pc&sr=1-1150
"HP Chromebook 14 14"" FHD Laptop Computer/ for Education or Student/ 4GB DDR4/ 32GB eMMC/ Intel Celeron N4000 Up to 2.6GHz/ 11+ Hrs Battery/ Webcam/ Chrome OS/ Work from Home/ iPuzzle Type-C HUB",http://www.amazon.com/HP-Chromebook-14-Computer-Education/dp/B08QTY369P/ref=sr_1_1151?dchild=1&keywords=laptop&qid=1634625468&refinements=p_n_condition-type%3A2224371011&rnid=2224369011&s=pc&sr=1-1151
"Portable Lenovo ThinkPad E15 Gen 2 Laptop, 15.6"" FHD IPS 250 nits, Ryzen 7 4700U, Backlit Keyboard，Wi-Fi 6, Webcam, HDMI, USB-C, AMD Radeon Graphics, Win 10 Pro 16GB, 512GB PCIe SSD, WOOV 32GB MSD",http://www.amazon.com/Lenovo-ThinkPad-E15-Gen-Keyboard%EF%BC%8CWi-Fi/dp/B0923VGKKH/ref=sr_1_1152?dchild=1&keywords=laptop&qid=1634625468&refinements=p_n_condition-type%3A2224371011&rnid=2224369011&s=pc&sr=1-1152
"HP 14.0"" FHD Laptop Computer, Hexa-Core AMD Ryzen 5 5500U up to 4.0GHz (Beat i5-10500H), 8GB DDR4 RAM, 256GB PCIe SSD, WiFi 6, Bluetooth 5.2, USB Type-C, Windows 10, BROAGE 500GB External Hard Drive",http://www.amazon.com/HP-Touchscreen-Computer-i5-7200U-Microphone/dp/B086C8BSG6/ref=sr_1_1153?dchild=1&keywords=laptop&qid=1634625472&refinements=p_n_condition-type%3A2224371011&rnid=2224369011&s=pc&sr=1-1153
"CUK Clevo X170 KMG 17 Inch Workstation Gaming Notebook (Intel Core i9, 64GB RAM, 2x2TB NVMe SSD, NVIDIA GeForce RTX 3080 16GB, 17.3"" FHD 300Hz, Windows 10 Pro) Gamer Laptop Computer",http://www.amazon.com/Workstation-Notebook-GeForce-Windows-Computer/dp/B098XWXRZ9/ref=sr_1_1154?dchild=1&keywords=laptop&qid=1634625472&refinements=p_n_condition-type%3A2224371011&rnid=2224369011&s=pc&sr=1-1154
"Dell Gaming G3 15 3500, 15.6 inch FHD Non-Touch Laptop - Intel Core i7-10750H, 16GB DDR4 RAM, 512GB SSD, NVIDIA GeForce RTX 2060 6GB GDDR6, Windows 10 Home - Black",http://www.amazon.com/Dell-G3-15-3500-i7-10750H/dp/B089HR6CQP/ref=sr_1_1155?dchild=1&keywords=laptop&qid=1634625472&refinements=p_n_condition-type%3A2224371011&rnid=2224369011&s=pc&sr=1-1155
"GPD Pocket 2 [Latest CPU Update-CPU Core m3-8100Y] 7"" Touch Screen Windows 10 Mini Portable Laptop UMPC Tablet PC GPU: HD Graphics 615 8GB RAM/256GB ROM",http://www.amazon.com/Update-8GB-Windows-Portable-Processor-Graphics/dp/B07MMSQ9ZM/ref=sr_1_1156?dchild=1&keywords=laptop&qid=1634625472&refinements=p_n_condition-type%3A2224371011&rnid=2224369011&s=pc&sr=1-1156
"ASUS - ROG Zephyrus 15.6"" QHD Gaming Laptop - AMD Ryzen 9 - 16GB Memory - NVIDIA GeForce RTX 3070 - 1TB SSD - Eclipse Grey - Eclipse Grey",http://www.amazon.com/ASUS-Zephyrus-Gaming-GeForce-Eclipse/dp/B08V8CDP8Q/ref=sr_1_1157?dchild=1&keywords=laptop&qid=1634625472&refinements=p_n_condition-type%3A2224371011&rnid=2224369011&s=pc&sr=1-1157
"2021 Newest HP Chromebook 11.6 Inch HD Laptop, MediaTek MT8183 8-core Processor, 4GB RAM, 32GB eMMC SSD, WiFi, Bluetooth, Webcam, Ash Gray, Chrome OS + Oydisen Cloth",http://www.amazon.com/HP-Chromebook-MediaTek-Processor-Bluetooth/dp/B08Q8174FS/ref=sr_1_1158?dchild=1&keywords=laptop&qid=1634625472&refinements=p_n_condition-type%3A2224371011&rnid=2224369011&s=pc&sr=1-1158
"Portable Lenovo ThinkPad E15 Gen 2 Laptop, 15.6"" FHD IPS 250 nits, Ryzen 7 4700U, Backlit Keyboard，Wi-Fi 6, Webcam, HDMI, USB-C, AMD Radeon Graphics, Win 10 Pro 16GB, 512GB PCIe SSD, WOOV 32GB MSD",http://www.amazon.com/Lenovo-ThinkPad-E15-Gen-Keyboard%EF%BC%8CWi-Fi/dp/B0923VGKKH/ref=sr_1_1159?dchild=1&keywords=laptop&qid=1634625472&refinements=p_n_condition-type%3A2224371011&rnid=2224369011&s=pc&sr=1-1159
"MSI 2021 Flagship GF63 Thin Gaming 15 Laptop 15.6"" FHD IPS Display 10th Gen Intel Quad-Core i5-10300H (Beats i7-8750H) 8GB RAM 256GB SSD GeForce GTX 1650 4GB Backlit WiFi6 Win10 + HDMI Cable",http://www.amazon.com/MSI-GF63-Thin-Quad-Core-i5-10300H/dp/B098BFXPB2/ref=sr_1_1160?dchild=1&keywords=laptop&qid=1634625472&refinements=p_n_condition-type%3A2224371011&rnid=2224369011&s=pc&sr=1-1160
"Latest Lenovo Flex 5 14"" FHD 2in1 Touch Screen Laptop, AMD Ryzen 5 5500U(>i7-10710U), AMD Radeon Graphics, USB-C, WiFi 6 , Fingerprint, Backlit KB, Webcam, HDMI, Win 10 H (16GB RAM | 512GB PCIe SSD)",http://www.amazon.com/Lenovo-Flex-i7-10710U-Graphics-Fingerprint/dp/B093RBQJKK/ref=sr_1_1161?dchild=1&keywords=laptop&qid=1634625472&refinements=p_n_condition-type%3A2224371011&rnid=2224369011&s=pc&sr=1-1161
"Dell XPS 13.4"" 2-in-1 Touchscreen Laptop, 10th Gen i7-1065G7 CPU, 16GB RAM, 512GB SSD",http://www.amazon.com/Dell-Touchscreen-Laptop-i7-1065G7-512GB/dp/B07SGCYN9P/ref=sr_1_1162?dchild=1&keywords=laptop&qid=1634625472&refinements=p_n_condition-type%3A2224371011&rnid=2224369011&s=pc&sr=1-1162
"Acer Chromebook 314, Intel Celeron N4000, 14"" Full HD Display, 4GB LPDDR4, 64GB eMMC, Gigabit WiFi, Google Chrome, CB314-1H-C884",http://www.amazon.com/Acer-Chromebook-Celeron-Display-CB314-1H-C884/dp/B0858N8CGX/ref=sr_1_1163?dchild=1&keywords=laptop&qid=1634625472&refinements=p_n_condition-type%3A2224371011&rnid=2224369011&s=pc&sr=1-1163
"HP Pavilion x360-14"" Touch - Core i5-10210U - 8GB - 256GB SSD + 16GB Optane - Gold",http://www.amazon.com/HP-Pavilion-x360-14-Touch-i5-10210U/dp/B08121Q5NZ/ref=sr_1_1164?dchild=1&keywords=laptop&qid=1634625472&refinements=p_n_condition-type%3A2224371011&rnid=2224369011&s=pc&sr=1-1164
"Lenovo Legion 5 Gaming Laptop, 17.3"" FHD IPS 300Nits 144Hz Display, AMD Ryzen 7 4800H, Webcam, Backlit Keyboard, Wi-Fi 6, USB-C, HDMI, GeForce GTX 1660 Ti, Win 10,32GB RAM | 1TB PCIe SSD",http://www.amazon.com/Lenovo-Legion-300Nits-Display-Keyboard/dp/B093PWQCYL/ref=sr_1_1165?dchild=1&keywords=laptop&qid=1634625472&refinements=p_n_condition-type%3A2224371011&rnid=2224369011&s=pc&sr=1-1165
"2021 Toshiba Dynabook Tecra A50-J 15.6"" HD Business Laptop (11th Gen Intel Quad-Core i7-1165G7, Iris Xe Graphics, 32GB DDR4 RAM, 1TB PCIe SSD) Wi-Fi 6, Type-C, DVD, Windows 10 Pro 64, IST HDMI Cable",http://www.amazon.com/Toshiba-Dynabook-Tecra-Quad-Core-i7-1165G7/dp/B08YNFHL8Y/ref=sr_1_1166?dchild=1&keywords=laptop&qid=1634625472&refinements=p_n_condition-type%3A2224371011&rnid=2224369011&s=pc&sr=1-1166
"Newest Asus VivoBook 15 F515 15.6"" FHD Thin and Light Laptop, 10th Gen Intel Core i3-1005G1, 12GB RAM, 512GB PCIe SSD, Backlit Keyboard, Fingerprint Reader, Windows 10 + Woov 32GB MicroSD Card",http://www.amazon.com/VivoBook-i3-1005G1-Backlit-Keyboard-Fingerprint/dp/B08Z7PXJV4/ref=sr_1_1167?dchild=1&keywords=laptop&qid=1634625472&refinements=p_n_condition-type%3A2224371011&rnid=2224369011&s=pc&sr=1-1167
"HP Notebook - 15-db0003ca 15.6"" AMD Ryzen 3 2200U 2.5 GHz AMD Radeon Vega 3 Graphics 8 GB RAM 1 TB HDD W10 Home 64 BT Webcam Natural Silver",http://www.amazon.com/HP-Notebook-15-db0003ca-Graphics-Natural/dp/B094BKMM2K/ref=sr_1_1168?dchild=1&keywords=laptop&qid=1634625472&refinements=p_n_condition-type%3A2224371011&rnid=2224369011&s=pc&sr=1-1168
"Sager NP8773R 0.78-Inch Thin Gaming Laptop, 17.3-Inch FHD 144Hz 72% NTSC, Intel i7-11800H, RTX 3070 8GB, 32GB RAM, 1TB NVMe SSD, TBT, Win 10",http://www.amazon.com/Sager-NP8773R-0-78-Inch-17-3-Inch-i7-11800H/dp/B09GRK13VN/ref=sr_1_1169?dchild=1&keywords=laptop&qid=1634625472&refinements=p_n_condition-type%3A2224371011&rnid=2224369011&s=pc&sr=1-1169
"Hyundai | HyFlip 13.3"" Laptop | 2-in-1 Touch Screen 1920 x 1020 Display | 4GB RAM | 64GB eMMC | Expandable Storage with M.2 SSD and MicroSD Slot | Windows 10 S Mode | Space Grey",http://www.amazon.com/Hyundai-Display-Expandable-Storage-MicroSD/dp/B093X27K3N/ref=sr_1_1170?dchild=1&keywords=laptop&qid=1634625472&refinements=p_n_condition-type%3A2224371011&rnid=2224369011&s=pc&sr=1-1170
Dell Inspiron 5505 Laptop AMD Ryzen(TM) 7 4700U 8GB DDR4 256GB M.2 PCIe NVMe Solid State Drive 15.6-inch FHD (1920 x 1080) Anti-Glare LED Backlight Non-Touch Narrow Border WVA Display,http://www.amazon.com/Dell-5505-15-6-inch-Anti-Glare-Backlight/dp/B08HW94QLT/ref=sr_1_1171?dchild=1&keywords=laptop&qid=1634625472&refinements=p_n_condition-type%3A2224371011&rnid=2224369011&s=pc&sr=1-1171
"Lenovo Chromebook 3 11 11.6"" Laptop Computer for Business Student, AMD A6-9220C up to 2.7GHz, 4GB LPDDR4 RAM, 32GB eMMC, 2x2 AC WiFi, Bluetooth 4.2, Webcam, Remote Work, Chrome OS, iPuzzle Type-C HUB",http://www.amazon.com/Lenovo-100e-Chromebook-Computer-Quad-Core/dp/B087K17N13/ref=sr_1_1172?dchild=1&keywords=laptop&qid=1634625472&refinements=p_n_condition-type%3A2224371011&rnid=2224369011&s=pc&sr=1-1172
New Dell Latitude 3190 2-in-1 Laptop - 128GB SSD - 8GB RAM - w/Free pre-Installed Office Professional Software/Windows 10 Pro,http://www.amazon.com/Dell-Latitude-3190-Laptop-pre-Installed/dp/B07MF1TLHY/ref=sr_1_1173?dchild=1&keywords=laptop&qid=1634625472&refinements=p_n_condition-type%3A2224371011&rnid=2224369011&s=pc&sr=1-1173
"HP Chromebook x360 14"" HD WLED-Backlit Touchscreen 2-in-1 Laptop Convertible Laptop, Intel Celeron N4000, 4GB RAM, 32GB eMMC, Webcam, Work, Play, Chrome OS, Ceramic White/Mineral Silver, ABYS Pen",http://www.amazon.com/HP-Chromebook-WLED-Backlit-Touchscreen-Convertible/dp/B09HCB1MSK/ref=sr_1_1174?dchild=1&keywords=laptop&qid=1634625472&refinements=p_n_condition-type%3A2224371011&rnid=2224369011&s=pc&sr=1-1174
"Lenovo ThinkPad E15 Gen 2 15.6"" FHD Business Laptop Computer, Intel Quad-Core i5-1135G7 up to 4.2GHz (Beat i7-1065G7), 8GB DDR4 RAM, 256GB PCIe SSD, WiFi 6, BT 5.2, Windows 10 Pro, 64GB Flash Drive",http://www.amazon.com/Lenovo-ThinkPad-E15-Octa-Core-i7-1065G7/dp/B089QGK9VX/ref=sr_1_1175?dchild=1&keywords=laptop&qid=1634625472&refinements=p_n_condition-type%3A2224371011&rnid=2224369011&s=pc&sr=1-1175
"Samsung Chromebook 4 11.6"" Laptop Computer for Business Student, Intel Celeron N4000 up to 2.6GHz, 4GB LPDDR4 RAM, 32GB eMMC, AC WiFi, Remote Work, Chrome OS, iPuzzle 64GB Green USB Flash Drive",http://www.amazon.com/Chromebook-Computer-Business-802-11ac-Mouse-Pad/dp/B087TCPRN1/ref=sr_1_1176?dchild=1&keywords=laptop&qid=1634625472&refinements=p_n_condition-type%3A2224371011&rnid=2224369011&s=pc&sr=1-1176
"2021 Newest Acer Chromebook Spin 2-in-1 Convertible Laptop Student Business use, 11.6"" HD Touchscreen, Intel Celeron N3350, 4GB RAM, 32GB eMMC, Zoom Meeting, Chrome OS w/GM 64GB SD Card",http://www.amazon.com/Acer-Chromebook-Convertible-Business-Touchscreen/dp/B093H1NRVJ/ref=sr_1_1177?dchild=1&keywords=laptop&qid=1634625475&refinements=p_n_condition-type%3A2224371011&rnid=2224369011&s=pc&sr=1-1177
"2021 Newest Lenovo Chromebook S330 Laptop, 14” HD Display, MediaTek MT8173C Processor, 4GB RAM, 32GB eMMC, Webcam, HDMI, WiFi, SD Card Reader, 10 Hours Battery, Chrome OS + Nly MP",http://www.amazon.com/Lenovo-Chromebook-S330-MediaTek-Processor/dp/B0939C6CJR/ref=sr_1_1178?dchild=1&keywords=laptop&qid=1634625475&refinements=p_n_condition-type%3A2224371011&rnid=2224369011&s=pc&sr=1-1178
"2021 Lenovo Chromebook Flex 3 11.6 Inch Touchscreen 2-in-1 Laptop with Webcam, MediaTek MT8173C 2.1GHz, 4GB RAM, 32GB eMMC, Bluetooth, Chrome OS + NexiGo 32GB MicroSD Card Bundle",http://www.amazon.com/Lenovo-Chromebook-Touchscreen-MediaTek-Bluetooth/dp/B08NGWM4HM/ref=sr_1_1179?dchild=1&keywords=laptop&qid=1634625475&refinements=p_n_condition-type%3A2224371011&rnid=2224369011&s=pc&sr=1-1179
"15.6 inch Laptop, IPS Display, 64-bit Quad-core celeron_j4115 Processor, 8GB RAM, 256GB SSD, scalable 1TB SSD Solid State Drive, 10000mAh high Battery Life, Windows 10 Pro",http://www.amazon.com/Quad-core-celeron_j4115-Processor-scalable-10000mAh/dp/B08P77J9PD/ref=sr_1_1180?dchild=1&keywords=laptop&qid=1634625475&refinements=p_n_condition-type%3A2224371011&rnid=2224369011&s=pc&sr=1-1180
"HP Envy X360 2-in-1 15.6"" FHD IPS Multitouch Screen Laptop | AMD Ryzen 7-4700U 8 cores | 16GB RAM | 512GB SSD | AMD Radeon | Backlit Keyboard | Fingerprint Reader | HDMI | Windows 10",http://www.amazon.com/HP-Multitouch-7-4700U-Keyboard-Fingerprint/dp/B08BLCR3R6/ref=sr_1_1181?dchild=1&keywords=laptop&qid=1634625475&refinements=p_n_condition-type%3A2224371011&rnid=2224369011&s=pc&sr=1-1181
"2021 Newest Lenovo Legion 5 15.6"" FHD 120GHz Gaming Laptop, 6-Cores AMD Ryzen 5-4600H Processor up to 4.0GHz, 8GB RAM, 256GB SSD, Backlit Keyboard, NVIDIA GeForce GTX 1650 4GB Graphics, Windows 10",http://www.amazon.com/Lenovo-6-Cores-Processor-Keyboard-Graphics/dp/B091BWLHW1/ref=sr_1_1182?dchild=1&keywords=laptop&qid=1634625475&refinements=p_n_condition-type%3A2224371011&rnid=2224369011&s=pc&sr=1-1182
"Latest_Lenovo ThinkPad P17 Mobile Workstation, 17.3"" FHD IPS Anti-Glare, Intel Core i7-10750H Processor, NVIDIA_Quadro T2000, 32GB RAM, 1TB SSD, Windows 10 Pro, Fingerprint Reader, Basrdis Support",http://www.amazon.com/Latest_Lenovo-Workstation-Anti-Glare-NVIDIA_Quadro-Fingerprint/dp/B08WCJCF4K/ref=sr_1_1183?dchild=1&keywords=laptop&qid=1634625475&refinements=p_n_condition-type%3A2224371011&rnid=2224369011&s=pc&sr=1-1183
"Jumper Laptop with Office 365 Personal for 1 Year, Traditional Laptop Computers 13.3'' Mini Laptop Intel N3350 4GB RAM 64GB ROM Laptops Supports up to 256GB TF Card Expansion (Red)",http://www.amazon.com/Jumper-Ebook-X3-Laptop-Processor-Windows/dp/B081K2K9WN/ref=sr_1_1184?dchild=1&keywords=laptop&qid=1634625475&refinements=p_n_condition-type%3A2224371011&rnid=2224369011&s=pc&sr=1-1184
"2019 HP 15.6"" HD Touchscreen Laptop Computer, 7th Gen Intel Core i3-7100U 2.40GHz, 8GB DDR4 RAM, 1TB HDD + 512GB SSD, 802.11AC Wifi, Bluetooth 4.2, DVDRW, USB 3.1, HDMI, Windows 10 Home,Gray",http://www.amazon.com/HP-Mobile-E3T73UT-ABA-14-Inch/dp/B00GVW49CQ/ref=sr_1_1185?dchild=1&keywords=laptop&qid=1634625475&refinements=p_n_condition-type%3A2224371011&rnid=2224369011&s=pc&sr=1-1185
"Lenovo 100E Chromebook 2ND Gen Laptop Computer, 11.6"" HD (1366 X 768) Display, MediaTek MT8173C Processor, 4GB RAM, eMMC TLC SSD, Powervr GX6250, Chrome OS, Black (32GB eMMC)",http://www.amazon.com/Lenovo-Chromebook-Computer-MediaTek-Processor/dp/B083S134NZ/ref=sr_1_1186?dchild=1&keywords=laptop&qid=1634625475&refinements=p_n_condition-type%3A2224371011&rnid=2224369011&s=pc&sr=1-1186
"Lenovo Yoga C940 2-in-1 14"" FHD IPS Touch Laptop, 10th Gen Intel Core i7-1065G7, 16GB DDR4, 1TB SSD PCIe, Thunderbolt 3, Active Stylus Pen, Fingerprint Reader 3 lbs - Iron Gray",http://www.amazon.com/Lenovo-Laptop-i7-1065G7-Thunderbolt-Fingerprint/dp/B088TXCCBL/ref=sr_1_1187?dchild=1&keywords=laptop&qid=1634625475&refinements=p_n_condition-type%3A2224371011&rnid=2224369011&s=pc&sr=1-1187
"2021 HP 14"" HD Touchscreen Laptop, AMD Ryzen 3 3250U Processor, 8GB RAM, 128GB SSD, Webcam, WiFi, Ethernet, HDMI, Windows 10 S, Natural Silver, W/ IFT Accessories",http://www.amazon.com/HP-Touchscreen-Processor-Ethernet-Accessories/dp/B08R1VWNDT/ref=sr_1_1188?dchild=1&keywords=laptop&qid=1634625475&refinements=p_n_condition-type%3A2224371011&rnid=2224369011&s=pc&sr=1-1188
"2020 Premium Lenovo Chromebook C340-15 2 in 1 Laptop, 15.6"" Full HD IPS Touchscreen, Intel Pentium Gold 4417U, 4GB DDR4 64GB eMMC SSD, HDMI Intel HD Graphics 610 Chrome OS with E.S 32GB USB Card",http://www.amazon.com/Premium-Lenovo-Chromebook-Touchscreen-Graphics/dp/B08CWCM2SC/ref=sr_1_1189?dchild=1&keywords=laptop&qid=1634625475&refinements=p_n_condition-type%3A2224371011&rnid=2224369011&s=pc&sr=1-1189
"Latest Model Lenovo ThinkPad P17 Mobile Workstation, 17.3"" Full HD IPS Screen (Intel Core i7-10750H, 32GB DDR4, 1TB PCIe SSD, NVIDIA Quadro T2000) Windows 10 Pro",http://www.amazon.com/Lenovo-ThinkPad-P17-Workstation-i7-10750H/dp/B08PMY93RC/ref=sr_1_1190?dchild=1&keywords=laptop&qid=1634625475&refinements=p_n_condition-type%3A2224371011&rnid=2224369011&s=pc&sr=1-1190
"Lenovo Flex 5 13.3"" FHD 2-in1 Touchscreen Laptop, Intel Core i3-10110U up to 4.1GHz, 8GB DDR4, 256GB NVMe SSD, Webcam, Bluetooth, Backlit Keyboard, Chrome OS, TWE 64GB Micro SD Card",http://www.amazon.com/Lenovo-Flex-Touchscreen-i3-10110U-Bluetooth/dp/B08TM7TRZY/ref=sr_1_1191?dchild=1&keywords=laptop&qid=1634625475&refinements=p_n_condition-type%3A2224371011&rnid=2224369011&s=pc&sr=1-1191
"HP 11.6"" HD Anti-Glare Chromebook Laptop, Octa-Core MediaTeck MT8183, 4GB DDR4, 64GB eMMC, Media Card Reader, WiFi, Bluetooth, Webcam, Remote Work, Chrome OS, Upto 15+ Hour Battery Life, TWE Accessory",http://www.amazon.com/HP-Anti-Glare-Chromebook-Octa-Core-MediaTeck/dp/B091JDDCYW/ref=sr_1_1192?dchild=1&keywords=laptop&qid=1634625475&refinements=p_n_condition-type%3A2224371011&rnid=2224369011&s=pc&sr=1-1192
Lenovo Yoga C740-14 FHD Touch - 10th gen i5-10210U - 8GB - 256GB SSD - Mica,http://www.amazon.com/Lenovo-Yoga-C740-14-FHD-Touch/dp/B08122HHX9/ref=sr_1_1193?dchild=1&keywords=laptop&qid=1634625475&refinements=p_n_condition-type%3A2224371011&rnid=2224369011&s=pc&sr=1-1193
"Newest 2021 HP 14"" Diagonal HD Laptop PC, Intel Core i5-1035G1 Processor, Intel UHD Graphics, 8GB SDRAM, 256GB SSD, 802.11ac, Bluetooth 5, HDMI, Windows 10, Natural Silver W/ Valinor Accessories",http://www.amazon.com/HP-i5-1035G1-Processor-Bluetooth-Accessories/dp/B09FJN33NY/ref=sr_1_1194?dchild=1&keywords=laptop&qid=1634625475&refinements=p_n_condition-type%3A2224371011&rnid=2224369011&s=pc&sr=1-1194
"2021 Lenovo IdeaPad 3 15.6"" HD Laptop Intel Dual-Core i3-1005G1 8GB RAM DDR4 256GB M.2 SSD Intel UHD Graphics HDMI Card Reader Bluetooth Webcam Almond Windows 10 w/ RE USB 3.0 Flash Drive",http://www.amazon.com/Lenovo-Dual-Core-i3-1005G1-Graphics-Bluetooth/dp/B08SLSBTPQ/ref=sr_1_1195?dchild=1&keywords=laptop&qid=1634625475&refinements=p_n_condition-type%3A2224371011&rnid=2224369011&s=pc&sr=1-1195
"Dell XPS 15 7590 Laptop 15.6 inch, 4K UHD OLED InfinityEdge, 9th Gen Intel Core i7-9750H, NVIDIA GeForce GTX 1650 4GB GDDR5, 256GB SSD, 16GB RAM, Windows 10 Home, XPS7590-7572SLV-PUS, 15-15.99 inches",http://www.amazon.com/Dell-XPS7590-7572SLV-PUS-i7-9750H-DDR4-2666MHz-GeForce/dp/B07T1DTF4F/ref=sr_1_1196?dchild=1&keywords=laptop&qid=1634625475&refinements=p_n_condition-type%3A2224371011&rnid=2224369011&s=pc&sr=1-1196
"Razer Blade 15 Gaming Laptop 2019: Intel Core i7-9750H 6 Core, NVIDIA GeForce RTX 2060, 15.6"" FHD 1080p 144Hz, 16GB RAM, 512GB SSD, CNC Aluminum, Chroma RGB Lighting, Thunderbolt 3",http://www.amazon.com/Razer-Blade-Gaming-Laptop-2019/dp/B07R1P4DQG/ref=sr_1_1197?dchild=1&keywords=laptop&qid=1634625475&refinements=p_n_condition-type%3A2224371011&rnid=2224369011&s=pc&sr=1-1197
"ASUS ZenBook Pro Duo 15 OLED UX582 Laptop, 15.6” OLED 4K UHD Touch Display, Intel Core i7-10870H, 16GB RAM, 1TB SSD, GeForce RTX 3070, ScreenPad Plus, Windows 10 Pro, Celestial Blue, UX582LR-XS74T",http://www.amazon.com/ASUS-i7-10870H-ScreenPad-Celestial-UX582LR-XS74T/dp/B08ZJQVV6G/ref=sr_1_1198?dchild=1&keywords=laptop&qid=1634625475&refinements=p_n_condition-type%3A2224371011&rnid=2224369011&s=pc&sr=1-1198
"HP Envy X360 2-in-1 Touchscreen Laptop 15.6"" FHD i7-10510U Business PC, 32GB RAM, 512GB SSD, Quad-Core up to 4.90 GHz, USB-C, Fingerprint, Backlight Keyboard, B&O Speakers, Webcam, Win 10",http://www.amazon.com/HP-Touchscreen-i7-10510U-Quad-Core-Fingerprint/dp/B0817M3WY5/ref=sr_1_1199?dchild=1&keywords=laptop&qid=1634625475&refinements=p_n_condition-type%3A2224371011&rnid=2224369011&s=pc&sr=1-1199
"Newest Asus Zenbook 14"" IPS FHD NanoEdge Bezel Display Ultra-Slim Laptop, 4th Gen AMD Ryzen 7 4700U 8-Core, 16GB RAM, 1TB PCIe SSD, Backlit Keyboard, NumberPad, Windows 10 Pro, Pine Gray",http://www.amazon.com/Zenbook-NanoEdge-Ultra-Slim-Keyboard-NumberPad/dp/B08J7QBD7C/ref=sr_1_1200?dchild=1&keywords=laptop&qid=1634625475&refinements=p_n_condition-type%3A2224371011&rnid=2224369011&s=pc&sr=1-1200
"Lenovo IdeaPad 3 15.6” HD Laptop (Latest Model), AMD Ryzen 3 3250U Processor, 8GB RAM, 128GB SSD, AMD Radeon Vega 3 Graphics, Webcam, WiFi, HDMI, Windows 10 S, Black + Nly MP",http://www.amazon.com/Lenovo-IdeaPad-Processor-Graphics-Windows/dp/B0982Z2RSZ/ref=sr_1_1201?dchild=1&keywords=laptop&qid=1634625478&refinements=p_n_condition-type%3A2224371011&rnid=2224369011&s=pc&sr=1-1201
"2021 Lenovo Yoga 9i 2-in-1 Laptop, 11th Gen Intel Core i7-1185G7, Intel Iris Xe Graphics, 14” FHD IPS Touchscreen, 16 GB DDR4, 1TB SSD, Active Stylus Pen, Thunderblot 4, Win 10 - Mica",http://www.amazon.com/Lenovo-i7-1185G7-Graphics-Touchscreen-Thunderblot/dp/B08VYLX37X/ref=sr_1_1202?dchild=1&keywords=laptop&qid=1634625478&refinements=p_n_condition-type%3A2224371011&rnid=2224369011&s=pc&sr=1-1202
"MSI Modern 14 Ultra Thin and Light Professional Laptop: 14"" FHD 1080p, Intel Core i5-10210U, UMA, 8GB, 512GB SSD, Win10, Carbon Gray (A10M-1052)",http://www.amazon.com/MSI-Modern-14-Professional-Laptop/dp/B09BXPTG7Z/ref=sr_1_1203?dchild=1&keywords=laptop&qid=1634625478&refinements=p_n_condition-type%3A2224371011&rnid=2224369011&s=pc&sr=1-1203
"2019 Lenovo Chromebook S330 14"" Thin and Light Laptop Computer, MediaTek MTK 8173C 1.70GHz, 4GB RAM, 32GB eMMC, 802.11ac WiFi, Bluetooth 4.1, USB 3.0, HDMI, Chrome OS",http://www.amazon.com/Lenovo-Chromebook-S330-Computer-Bluetooth/dp/B07JC8V69B/ref=sr_1_1204?dchild=1&keywords=laptop&qid=1634625478&refinements=p_n_condition-type%3A2224371011&rnid=2224369011&s=pc&sr=1-1204
"Dell Inspiron 15 15.6“ HD Anti-Glare LED-Backlit Laptop, Intel Pentium Gold 5405U, 8GB DDR4, 256GB PCIe SSD, HDMI, 802.11ac, Bluetooth, Webcam, Windows 10 in S Mode",http://www.amazon.com/Dell-Inspiron-15-Anti-Glare-LED-Backlit/dp/B09995STBD/ref=sr_1_1205?dchild=1&keywords=laptop&qid=1634625478&refinements=p_n_condition-type%3A2224371011&rnid=2224369011&s=pc&sr=1-1205
"Lenovo IdeaPad 5 14.0"" FHD IPS 300nits Laptop, AMD Ryzen 7 4700U, Webcam, Backlit Keyboard, Fingerprint Reader, Wi-Fi 6, HDMI, USB-C, AMD Radeon Graphics, Windows 10 Home (16GB RAM | 1TB PCIe SSD)",http://www.amazon.com/Lenovo-IdeaPad-Keyboard-Fingerprint-Graphics/dp/B08YXVHMXC/ref=sr_1_1206?dchild=1&keywords=laptop&qid=1634625478&refinements=p_n_condition-type%3A2224371011&rnid=2224369011&s=pc&sr=1-1206
Lenovo IdeaPad 1 81VU 14-Inch HD LED AMD A6 4GB RAM 128GB SSD Win 10 S Mode,http://www.amazon.com/Lenovo-IdeaPad-81VU-14-Inch-128GB/dp/B08DMGTDQL/ref=sr_1_1207?dchild=1&keywords=laptop&qid=1634625478&refinements=p_n_condition-type%3A2224371011&rnid=2224369011&s=pc&sr=1-1207
"Lenovo Legion 5 Gaming Laptop 15.6"" FHD IPS 120Hz Display, Intel Core I7-10750H, 16GB RAM, 512GB PCIe + 1TB HDD, GTX 1660 Ti, WiFi, RGB Backlit Keyboard, HDMI, Win10 Home, Black",http://www.amazon.com/Lenovo-Display-I7-10750H-Backlit-Keyboard/dp/B09B14YMHN/ref=sr_1_1208?dchild=1&keywords=laptop&qid=1634625478&refinements=p_n_condition-type%3A2224371011&rnid=2224369011&s=pc&sr=1-1208
"ASUS Zenbook 14 Laptop - AMD Ryzen 5-8GB RAM - NVIDIA GEFORCE MX350-256GB SSD - Win 10, Light Gray",http://www.amazon.com/ASUS-Zenbook-14-Laptop-MX350-256GB/dp/B08C81JT39/ref=sr_1_1209?dchild=1&keywords=laptop&qid=1634625478&refinements=p_n_condition-type%3A2224371011&rnid=2224369011&s=pc&sr=1-1209
"MSI Summit B14 Professional Laptop: 14"" IPS-Level Display, Intel Core i5-1135G7, Intel Iris Xe, 8GB RAM, 512GTB NVMe SSD, Win10 PRO, Ink Black (A11M-077)",http://www.amazon.com/MSI-Summit-B14-Professional-Laptop/dp/B08KBDS2K3/ref=sr_1_1210?dchild=1&keywords=laptop&qid=1634625478&refinements=p_n_condition-type%3A2224371011&rnid=2224369011&s=pc&sr=1-1210
"GIGABYTE A5 X1 - 15.6"" FHD IPS Anti-Glare 240Hz - AMD Ryzen 9 5900HX - NVIDIA GeForce RTX 3070 Laptop GPU 8 GB GDDR6 - 16 GB Memory - 512 GB PCIe SSD-Windows 10 Home-Gaming Laptop (A5 X1-CUS2130SH)",http://www.amazon.com/GIGABYTE-A5-SSD-Windows-Home-Gaming-X1-CUS2130SH/dp/B09GP88NBY/ref=sr_1_1211?dchild=1&keywords=laptop&qid=1634625478&refinements=p_n_condition-type%3A2224371011&rnid=2224369011&s=pc&sr=1-1211
"CUK ROG Strix G17 Gaming Notebook (AMD Ryzen 9, 2X32GB RAM, 2TB NVMe SSD, NVIDIA GeForce RTX 3060 6GB, 15.6"" FHD 144Hz Display, Windows 10 Home) 17 Inch Gamer Laptop Computer (Made_by_ASUS_)",http://www.amazon.com/Gaming-GeForce-Windows-Notebook-Computer/dp/B08D3WSLGL/ref=sr_1_1212?dchild=1&keywords=laptop&qid=1634625478&refinements=p_n_condition-type%3A2224371011&rnid=2224369011&s=pc&sr=1-1212
"ASUS ZenBook 14 UM433DA-DH75 90NB0PD6-M00680 Silver Laptop/Ryzen 7 3700U/8GB/512GB PCIe SSD/14.0"" Flat Full HD (1920x1080)/AMD Radeon RX Vega 10/Windows 10 Home",http://www.amazon.com/ASUS-ZenBook-UM433DA-DH75-90NB0PD6-M00680-1920x1080/dp/B084ZPT9ST/ref=sr_1_1213?dchild=1&keywords=laptop&qid=1634625478&refinements=p_n_condition-type%3A2224371011&rnid=2224369011&s=pc&sr=1-1213
"2020 HP Chromebook 14"" HD Thin and Light Laptop, Intel Celeron N4000 Dual-Core Processor, 4GB RAM, 32GB eMMC, Backlit Keyboard, WiFi, Up to 13 hrs Battery Life, Chrome OS, Ceramic White",http://www.amazon.com/HP-Chromebook-Dual-Core-Processor-Keyboard/dp/B08JG35YD2/ref=sr_1_1214?dchild=1&keywords=laptop&qid=1634625478&refinements=p_n_condition-type%3A2224371011&rnid=2224369011&s=pc&sr=1-1214
"Lenovo Chromebook Flex 3 11.6"" HD Touchscreen 2-in-1 Laptop Computer PC, Intel Celeron N4020, 4GB DDR4, 32GB eMMC, Intel UHD 600, 802.11ac, Bluetooth, Webcam, Chrome OS, Blue, 64GB ABYS MicroSD Card",http://www.amazon.com/Lenovo-Chromebook-Flex-Touchscreen-Bluetooth/dp/B09BCDK3KN/ref=sr_1_1215?dchild=1&keywords=laptop&qid=1634625478&refinements=p_n_condition-type%3A2224371011&rnid=2224369011&s=pc&sr=1-1215
"LG IPS Laptop 14"" Full HD (1920 x 1080) IPS Display, Intel 10th Generation i5, 8GB RAM, 256GB SSD, Durable, 18 Hr Battery Life - 2020",http://www.amazon.com/LG-Gram-Laptop-i5-1035G7-Thunderbolt/dp/B082XQWNPY/ref=sr_1_1216?dchild=1&keywords=laptop&qid=1634625478&refinements=p_n_condition-type%3A2224371011&rnid=2224369011&s=pc&sr=1-1216
