Name,URL
"Acer Aspire 5 A515-46-R14K Slim Laptop | 15.6"" Full HD IPS | AMD Ryzen 3 3350U Quad-Core Mobile Processor | 4GB DDR4 | 128GB NVMe SSD | WiFi 6 | Backlit KB | Amazon Alexa | Windows 10 Home (S mode)",http://www.amazon.com/Acer-A515-46-R14K-Quad-Core-Processor-Backlit/dp/B08VKNVDDR/ref=sr_1_1?dchild=1&keywords=laptop&qid=1634625293&refinements=p_n_condition-type%3A2224371011&rnid=2224369011&s=pc&sr=1-1
"HP 14 Laptop, AMD Ryzen 5 5500U, 8 GB RAM, 256 GB SSD Storage, 14-inch Full HD Display, Windows 10 Home, Thin & Portable, Micro-Edge & Anti-Glare Screen, Long Battery Life (14-fq1021nr, 2021)",http://www.amazon.com/HP-Portable-Micro-Edge-Anti-Glare-14-fq1021nr/dp/B091D9652Z/ref=sr_1_2?dchild=1&keywords=laptop&qid=1634625293&refinements=p_n_condition-type%3A2224371011&rnid=2224369011&s=pc&sr=1-2
"Acer Nitro 5 AN515-55-53E5 Gaming Laptop | Intel Core i5-10300H | NVIDIA GeForce RTX 3050 Laptop GPU | 15.6"" FHD 144Hz IPS Display | 8GB DDR4 | 256GB NVMe SSD | Intel Wi-Fi 6 | Backlit Keyboard",http://www.amazon.com/Acer-AN515-55-53E5-i5-10300H-GeForce-Keyboard/dp/B092YHJGMN/ref=sr_1_3?dchild=1&keywords=laptop&qid=1634625293&refinements=p_n_condition-type%3A2224371011&rnid=2224369011&s=pc&sr=1-3
"HP 15 Laptop, 11th Gen Intel Core i5-1135G7 Processor, 8 GB RAM, 256 GB SSD Storage, 15.6” Full HD IPS Display, Windows 10 Home, HP Fast Charge, Lightweight Design (15-dy2021nr, 2020)",http://www.amazon.com/HP-i5-1135G7-Processor-Lightweight-15-dy2021nr/dp/B08KGZ79N6/ref=sr_1_4?dchild=1&keywords=laptop&qid=1634625293&refinements=p_n_condition-type%3A2224371011&rnid=2224369011&s=pc&sr=1-4
"HP Pavilion 15 Laptop, 11th Gen Intel Core i7-1165G7 Processor, 16 GB RAM, 512 GB SSD Storage, Full HD IPS micro-edge Display, Windows 10 Pro, Compact Design, Long Battery Life (15-eg0021nr, 2020)",http://www.amazon.com/HP-i7-1165G7-Processor-Micro-Edge-15-eg0021nr/dp/B08KGYDR16/ref=sr_1_5?dchild=1&keywords=laptop&qid=1634625293&refinements=p_n_condition-type%3A2224371011&rnid=2224369011&s=pc&sr=1-5
"Windows Laptop 15.6 inch 8GB RAM DDR4 256GB M.2 SSD Notebook Computers, Intel J4125Quad-Core Computer Laptop, 1080P IPS Windows10 Pro PC Laptops, Full Size Keyboard",http://www.amazon.com/Notebook-Computers-J4125Quad-Core-Computer-Windows10/dp/B098QGZMT2/ref=sr_1_6?dchild=1&keywords=laptop&qid=1634625293&refinements=p_n_condition-type%3A2224371011&rnid=2224369011&s=pc&sr=1-6
"HP 17 Laptop, 11th Gen Intel Core i5-1135G7, 8 GB RAM, 256 GB SSD Storage, 17.3-inch HD+ Display, Windows 10 Home, Anti-Glare Screen, Long Battery Life, Web-cam & Dual Mics (17-cn0021nr, 2021)",http://www.amazon.com/HP-i5-1135G7-17-3-inch-Anti-Glare-17-cn0021nr/dp/B08ZK18TWF/ref=sr_1_7?dchild=1&keywords=laptop&qid=1634625293&refinements=p_n_condition-type%3A2224371011&rnid=2224369011&s=pc&sr=1-7
"ASUS Laptop L510 Ultra Thin Laptop, 15.6” FHD Display, Intel Celeron N4020 Processor, 4GB RAM, 128GB Storage, Windows 10 Home in S Mode, 1 Year Microsoft 365, Star Black, L510MA-DS04",http://www.amazon.com/ASUS-Display-Processor-Microsoft-L510MA-DS04/dp/B08XB41YVQ/ref=sr_1_8?dchild=1&keywords=laptop&qid=1634625293&refinements=p_n_condition-type%3A2224371011&rnid=2224369011&s=pc&sr=1-8
"Acer Aspire 5 A515-56-36UT Slim Laptop | 15.6"" Full HD Display | 11th Gen Intel Core i3-1115G4 Processor | 4GB DDR4 | 128GB NVMe SSD | WiFi 6 | Amazon Alexa | Windows 10 Home (S mode)",http://www.amazon.com/Acer-A515-56-36UT-Display-i3-1115G4-Processor/dp/B08VKT45K4/ref=sr_1_9?dchild=1&keywords=laptop&qid=1634625293&refinements=p_n_condition-type%3A2224371011&rnid=2224369011&s=pc&sr=1-9
"2021 Newest HP Laptop, 15.6"" FHD Display, AMD Ryzen 3-3250 2-Core Processor, 16GB DDR4 Memory, 1TB PCIe NVMe M.2 SSD, Wi-Fi, HDMI, Webcam, Bluetooth, Windows 10 Home, Silver",http://www.amazon.com/HP-Display-Processor-Bluetooth-Windows/dp/B09FYC497D/ref=sr_1_10?dchild=1&keywords=laptop&qid=1634625293&refinements=p_n_condition-type%3A2224371011&rnid=2224369011&s=pc&sr=1-10
"2021 Newest Dell Inspiron 15 3000 Laptop, 15.6 inch HD Display, Intel Pentium Silver N5030 Processor(4-Core,up to 3.1 GHz), 16GB DDR4 RAM, 512GB SSD, Webcam, WiFi, HDMI, Black, Windows 10 S",http://www.amazon.com/Dell-Inspiron-15-Display-Processor/dp/B09FLBJY21/ref=sr_1_11?dchild=1&keywords=laptop&qid=1634625293&refinements=p_n_condition-type%3A2224371011&rnid=2224369011&s=pc&sr=1-11
"2021 Newest Lenovo Ideapad 3 15.6"" Premium FHD Laptop, 6-core AMD Ryzen 5 5500U(up to 4.0GHz), 20GB RAM 512GB NVMe SSD, AMD Radeon 7, up to 12 Hours, Webcam HDMI Win 10 w/GM Accessories",http://www.amazon.com/Newest-Lenovo-Ideapad-Premium-Accessories/dp/B09B3CD1K3/ref=sr_1_12?dchild=1&keywords=laptop&qid=1634625293&refinements=p_n_condition-type%3A2224371011&rnid=2224369011&s=pc&sr=1-12
"HP Stream 11.6-inch HD Laptop, Intel Celeron N4000, 4 GB RAM, 32 GB eMMC, Windows 10 Home in S Mode with Office 365 Personal for 1 Year (11-ak0010nr, Royal Blue)",http://www.amazon.com/HP-11-6-inch-Celeron-Personal-11-ak0010nr/dp/B0886JS35F/ref=sr_1_13?dchild=1&keywords=laptop&qid=1634625293&refinements=p_n_condition-type%3A2224371011&rnid=2224369011&s=pc&sr=1-13
"2021 Newest HP 14"" HD Laptop Light-Weight, AMD 3020e(Up to 2.6GHz), 8GB RAM, 256GB SSD + 64GB eMMC, 1 Year Office 365, WiFi, Bluetooth 5, USB Type-A&C, HDMI, Webcam, Win10, w/Ghost Manta Accessories",http://www.amazon.com/Newest-HP-Light-Weight-Bluetooth-Accessories/dp/B09BMQQMY3/ref=sr_1_14?dchild=1&keywords=laptop&qid=1634625293&refinements=p_n_condition-type%3A2224371011&rnid=2224369011&s=pc&sr=1-14
"HP Pavilion Laptop (2021 Latest Model), 15.6"" FHD Display, Intel Celeron Processor, 8GB DDR4 RAM, 128GB SSD, Online Conferencing, Webcam, HDMI, WiFi, Bluetooth, Wins 10 + One Year Office 365",http://www.amazon.com/HP-Pavilion-Processor-Conferencing-Bluetooth/dp/B09BBHXYZ9/ref=sr_1_15?dchild=1&keywords=laptop&qid=1634625293&refinements=p_n_condition-type%3A2224371011&rnid=2224369011&s=pc&sr=1-15
"ASUS VivoBook F512 Thin and Lightweight Laptop, 15.6” FHD WideView NanoEdge , AMD R5-3500U CPU, 8GB RAM, 256GB SSD, Backlit KB, Fingerprint Reader, Windows 10, Peacock Blue, F512DA-EB51",http://www.amazon.com/ASUS-VivoBook-R5-3500U-Graphics-F512DA-EB51/dp/B07QQB7552/ref=sr_1_16?dchild=1&keywords=laptop&qid=1634625293&refinements=p_n_condition-type%3A2224371011&rnid=2224369011&s=pc&sr=1-16
"2021 Newest HP Laptop Computer, 15.6"" HD Display,Intel Pentium Dual-core N5000 Upto 2.7 GHz, 8GB DDR4 RAM, 128GB SSD, HD Webcam, HDMI, Bluetooth, WiFi, Win10 S, 10+ Hours Battery, w/Hubxcel Cables",http://www.amazon.com/HP-Laptop-15-6-Dual-core-Bluetooth/dp/B0971LP1JF/ref=sr_1_17?dchild=1&keywords=laptop&qid=1634625293&refinements=p_n_condition-type%3A2224371011&rnid=2224369011&s=pc&sr=1-17
Dell Inspiron 3000 15” Laptop Intel Celeron – 128GB SSD+500GB HDD – 8GB DDR4 – 1.8GHz - Intel UHD Graphics - Windows 10 Home - Inspiron 15 3000 Series - New,http://www.amazon.com/Dell-Inspiron-3000-Laptop-Celeron/dp/B09F626YKW/ref=sr_1_18?dchild=1&keywords=laptop&qid=1634625293&refinements=p_n_condition-type%3A2224371011&rnid=2224369011&s=pc&sr=1-18
"HP 14 Laptop, AMD 3020e, 4 GB RAM, 64 GB eMMC Storage, 14-inch HD Touchscreen, Windows 10 Home in S Mode, Long Battery Life, Microsoft 365, (14-fq0040nr, 2020)",http://www.amazon.com/HP-Storage-Touchscreen-Microsoft-14-fq0040nr/dp/B08CM17RPZ/ref=sr_1_19?dchild=1&keywords=laptop&qid=1634625293&refinements=p_n_condition-type%3A2224371011&rnid=2224369011&s=pc&sr=1-19
"2021 ASUS L510 Ultra Thin Laptop, 15.6"" FHD Display, Intel Celeron N4020 Processor, 4GB RAM, 256 GB Storage, 8Hrs+ Battery Life, Backlit Keyboard, Windows 10 Home + 1 Year Microsoft 365, Star Black",http://www.amazon.com/ASUS-L510-Processor-Keyboard-Microsoft/dp/B09D21T7R8/ref=sr_1_20?dchild=1&keywords=laptop&qid=1634625293&refinements=p_n_condition-type%3A2224371011&rnid=2224369011&s=pc&sr=1-20
"HP Pavilion Premium Laptop (2021 Model), 15.6"" FHD Display, AMD Athlon N3050, AMD Radeon Graphics, 16GB RAM, 512GB SSD, Thin & Portable, Micro-Edge & Anti-Glare Screen, Long Battery Life, Win10",http://www.amazon.com/HP-Pavilion-Graphics-Micro-Edge-Anti-Glare/dp/B09FFVNJPF/ref=sr_1_21?dchild=1&keywords=laptop&qid=1634625293&refinements=p_n_condition-type%3A2224371011&rnid=2224369011&s=pc&sr=1-21
"HP Chromebook 14 Laptop, Dual-core Intel Celeron Processor N3350, 4 GB RAM, 32 GB eMMC Storage, 14-inch FHD IPS Display, Google Chrome OS, Dual Speakers and Audio by B&O (14-ca051nr, 2020)",http://www.amazon.com/HP-Chromebook-Dual-core-Processor-14-ca051nr/dp/B08L8GXD2F/ref=sr_1_22?dchild=1&keywords=laptop&qid=1634625293&refinements=p_n_condition-type%3A2224371011&rnid=2224369011&s=pc&sr=1-22
"2021 Newest HP 14"" HD Laptop for Business and Student, Intel Celeron N4020(up to 2.8GHz), 4GB RAM, 64GB eMMC, 1 Year Office 365, USB-A&C, WiFi, Webcam, HDMI, Win10 S, w/64GB SD Card",http://www.amazon.com/Newest-HP-Business-Student-Celeron/dp/B08VJ1FCXK/ref=sr_1_23?dchild=1&keywords=laptop&qid=1634625293&refinements=p_n_condition-type%3A2224371011&rnid=2224369011&s=pc&sr=1-23
"MSI GL65 Gaming Laptop: 15.6"" Display, Intel Core i5-10300H, NVIDIA GeForce GTX 1650, 16GB RAM, 512GB NVMe SSD, Win10, Black (10SCXK-211)",http://www.amazon.com/MSI-GL65-Gaming-Laptop-10SCXK-211/dp/B0912CGY5Q/ref=sr_1_24?dchild=1&keywords=laptop&qid=1634625293&refinements=p_n_condition-type%3A2224371011&rnid=2224369011&s=pc&sr=1-24
"2020 HP 15.6"" Touchscreen Laptop Computer/ 10th Gen Intel Quard-Core i5 1035G1 up to 3.6GHz/ 12GB DDR4 RAM/ 256GB PCIe SSD/ 802.11ac WiFi/ Bluetooth 4.2/ USB 3.1 Type-C/ HDMI/ Silver/ Windows 10 Home",http://www.amazon.com/HP-Touchscreen-Computer-Quard-Core-Bluetooth/dp/B08BMLZKL2/ref=sr_1_25?dchild=1&keywords=laptop&qid=1634625300&refinements=p_n_condition-type%3A2224371011&rnid=2224369011&s=pc&sr=1-25
Lenovo IdeaPad 3 Intel i5-1035G1 Quad Core 12GB RAM 256GB SSD 15.6-inch Touch Screen Laptop,http://www.amazon.com/Lenovo-IdeaPad-i5-1035G1-15-6-inch-Screen/dp/B08NXSJVCR/ref=sr_1_26?dchild=1&keywords=laptop&qid=1634625300&refinements=p_n_condition-type%3A2224371011&rnid=2224369011&s=pc&sr=1-26
"HP 15.6 inch Full HD Laptop, AMD 6-Cores Ryzen 5-5500, AMD Radeon Graphics, HP Fast Charge, Webcam, Thin&Portable, 16GB DDR4 RAM, 512GB PCIE SSD, Windows 10 Home, Natural Silver",http://www.amazon.com/HP-6-Cores-Graphics-Portable-Windows/dp/B09CD34PB5/ref=sr_1_27?dchild=1&keywords=laptop&qid=1634625300&refinements=p_n_condition-type%3A2224371011&rnid=2224369011&s=pc&sr=1-27
"2021 Dell Inspiron 15 3000 Laptop, 15.6"" HD Display, Intel Celeron Processor N4020 (up to 2.8 GHz), 16GB DDR4 RAM, 512GB SSD, Webcam, WiFi, HDMI, Black, Windows 10",http://www.amazon.com/Dell-Inspiron-15-Display-Processor/dp/B09F5KMH9L/ref=sr_1_28?dchild=1&keywords=laptop&qid=1634625300&refinements=p_n_condition-type%3A2224371011&rnid=2224369011&s=pc&sr=1-28
"HP Pavilion x360 14” Touchscreen Laptop, 11th Gen Intel Core i5-1135G7, 8 GB RAM, 256 GB SSD Storage, Full HD IPS Display, Windows 10 Home OS, Long Battery Life, Work & Streaming (14-dw1024nr, 2021)",http://www.amazon.com/HP-Touchscreen-i5-1135G7-Streaming-14-dw1024nr/dp/B091D6F3JP/ref=sr_1_29?dchild=1&keywords=laptop&qid=1634625300&refinements=p_n_condition-type%3A2224371011&rnid=2224369011&s=pc&sr=1-29
"2021 Newest Dell Inspiron 3000 Laptop, 15.6 HD LED-Backlit Display, Intel Celeron Processor N4020, 16GB DDR4 RAM, 2TB Hard Disk Drive, Online Meeting Ready, Webcam, WiFi, HDMI, Win10 Home, Black",http://www.amazon.com/Dell-Inspiron-LED-Backlit-Display-Processor/dp/B08X1C7F5K/ref=sr_1_30?dchild=1&keywords=laptop&qid=1634625300&refinements=p_n_condition-type%3A2224371011&rnid=2224369011&s=pc&sr=1-30
"2021 HP Laptop 15.6"" HD Touch Screen, 11th Gen Intel Core i5-1135G7(Beat i7-1065G7), 16GB RAM, 1TB SSD, Backlit Keyboard, HDMI, Wi-Fi, Webcam, Windows 10 | VAATE HDMI Cable",http://www.amazon.com/HP-Laptop-i5-1135G7-i7-1065G7-Keyboard/dp/B09FD465LS/ref=sr_1_31?dchild=1&keywords=laptop&qid=1634625300&refinements=p_n_condition-type%3A2224371011&rnid=2224369011&s=pc&sr=1-31
"2021 Newest HP 15.6"" FHD 1080P IPS Anti-Glare Laptop, Intel Processor N4020, 8GB DDR4 RAM, 512GB SSD, 1-Year Office 365, Online Meeting Ready, Ethernet, WiFi, Fast Charge, Win10 S, w/GM Accessories",http://www.amazon.com/HP-Anti-Glare-Processor-Ethernet-Accessories/dp/B09BKXJ227/ref=sr_1_32?dchild=1&keywords=laptop&qid=1634625300&refinements=p_n_condition-type%3A2224371011&rnid=2224369011&s=pc&sr=1-32
"2021 HP 14 inch HD Laptop Newest for Business and Student, AMD Athlon Silver 3050U (Beat i5-7200U), 16GB DDR4 RAM, 512GB SSD, 802.11ac, WiFi, Bluetooth, HDMI, Windows 10 w/HESVAP 3in1 Accessories",http://www.amazon.com/HP-Business-i5-7200U-Bluetooth-Accessories/dp/B087WR7LXQ/ref=sr_1_33?dchild=1&keywords=laptop&qid=1634625300&refinements=p_n_condition-type%3A2224371011&rnid=2224369011&s=pc&sr=1-33
"2021 Newest HP Premium 14 inch HD Laptop, Intel Dual-Core Processor Up to 2.6GHz, 8GB RAM, 64GB eMMC Storage, Webcam, Bluetooth, HDMI, Wi-Fi, Blue, Windows 10 with 1 Year Microsoft 365",http://www.amazon.com/HP-Premium-Dual-Core-Processor-Bluetooth/dp/B09GKZ1HYV/ref=sr_1_34?dchild=1&keywords=laptop&qid=1634625300&refinements=p_n_condition-type%3A2224371011&rnid=2224369011&s=pc&sr=1-34
"2021 Newest Dell Inspiron 3000 Laptop, 15.6 HD Display, Intel Celeron Processor N4020, 16GB DDR4 RAM, 512GB PCIe Solid State Drive, Online Meeting Ready, Webcam, WiFi, HDMI, Win10 Pro, Black",http://www.amazon.com/Dell-Inspiron-Display-Celeron-Processor/dp/B0945B12NR/ref=sr_1_35?dchild=1&keywords=laptop&qid=1634625300&refinements=p_n_condition-type%3A2224371011&rnid=2224369011&s=pc&sr=1-35
"HP Pavilion Laptop (2021 Latest Model), AMD Athlon 3050U Processor, 16GB RAM, 256GB SSD, Long Battery Life, Webcam, HDMI, Bluetooth, WiFi, Rose Gold, Win 10 + Oydisen Cloth",http://www.amazon.com/HP-Pavilion-Processor-Battery-Bluetooth/dp/B0929G1GR3/ref=sr_1_36?dchild=1&keywords=laptop&qid=1634625300&refinements=p_n_condition-type%3A2224371011&rnid=2224369011&s=pc&sr=1-36
"Acer Predator Helios 300 PH315-54-760S Gaming Laptop | Intel i7-11800H | NVIDIA GeForce RTX 3060 Laptop GPU | 15.6"" Full HD 144Hz 3ms IPS Display | 16GB DDR4 | 512GB SSD | Killer WiFi 6 | RGB Keyboard",http://www.amazon.com/Acer-Predator-PH315-54-760S-i7-11800H-Keyboard/dp/B092YHJLS6/ref=sr_1_37?dchild=1&keywords=laptop&qid=1634625300&refinements=p_n_condition-type%3A2224371011&rnid=2224369011&s=pc&sr=1-37
"2021 Newest HP 17.3"" FHD Laptop, AMD Ryzen 5 5500U 6-core(Beat i7-1160G7, up to 4.0GHz), 16GB RAM, 1TB PCIe SSD, Bluetooth 4.2, WiFi, HDMI, USB-A&C, Windows 10 S, w/Ghost Manta Accessories",http://www.amazon.com/HP-i7-1160G7-Bluetooth-Windows-Accessories/dp/B09FF2JPMY/ref=sr_1_38?dchild=1&keywords=laptop&qid=1634625300&refinements=p_n_condition-type%3A2224371011&rnid=2224369011&s=pc&sr=1-38
"Lenovo IdeaPad Thin and Light Laptop, 15.6"" FHD Display, AMD Ryzen 5 5500U Processor (Beats i7-1185G7), 20GB RAM, 512GB PCIe SSD, Backlit Keyboard, Fingerprint Reader, Windows 10, Sand (Latest Model)",http://www.amazon.com/Lenovo-IdeaPad-Processor-i7-1185G7-Fingerprint/dp/B098Z6H3J5/ref=sr_1_39?dchild=1&keywords=laptop&qid=1634625300&refinements=p_n_condition-type%3A2224371011&rnid=2224369011&s=pc&sr=1-39
"Lenovo IdeaPad 3 11 Chromebook 11.6"" Laptop, 11.6"" HD (1366 x 768) Display, Intel Celeron N4020 Processor, 4GB LPDDR4 RAM, 64GB eMMC Storage, Intel UHD Graphics 600, Chrome OS, 82BA0003US, Onyx Black",http://www.amazon.com/Lenovo-Chromebook-Processor-Graphics-82BA0003US/dp/B087YW8FQB/ref=sr_1_40?dchild=1&keywords=laptop&qid=1634625300&refinements=p_n_condition-type%3A2224371011&rnid=2224369011&s=pc&sr=1-40
"Dell Inspiron 15 3000 (3593) Laptop Computer - 15.6 inch HD Anti-Glare Display (Intel Core 11th Gen i5-1035G1, 8GB, 256GB PCIe M.2 NVMe SSD, Camera) Windows 10 Home",http://www.amazon.com/Dell-Inspiron-3000-Laptop-Computer/dp/B08R62MNF4/ref=sr_1_41?dchild=1&keywords=laptop&qid=1634625300&refinements=p_n_condition-type%3A2224371011&rnid=2224369011&s=pc&sr=1-41
"2021 HP 15.6"" Thin Laptop, Intel N4020, 8GB RAM 256GB SSD Webcam, 1-Year Office365, Wi-Fi, Dual Core up to 2.8 GHz, Windows 10 S, FHD Display, Google Classroom Zoom School Business Ready, ROKC Bundle",http://www.amazon.com/HP-Office365-Windows-Classroom-Business/dp/B099Y6MFDH/ref=sr_1_42?dchild=1&keywords=laptop&qid=1634625300&refinements=p_n_condition-type%3A2224371011&rnid=2224369011&s=pc&sr=1-42
"2021 Newest HP 15.6 FHD IPS Flagship Laptop, 11th Gen Intel 4-Core i5-1135G7(Up to 4.2GHz, Beat i7-1060G7), 16GB RAM, 512GB PCIe SSD, Iris Xe Graphics, Fingerprint, WiFi, Win10 S, w/GM Accessories",http://www.amazon.com/HP-i5-1135G7-i7-1060G7-Fingerprint-Accessories/dp/B09G9K16KF/ref=sr_1_43?dchild=1&keywords=laptop&qid=1634625300&refinements=p_n_condition-type%3A2224371011&rnid=2224369011&s=pc&sr=1-43
"2021 HP Stream 14inch HD Display, Intel Celeron N4020 Dual-Core Processor, 4GB DDR4 Memory, 128 GB storage (64GB eMMC+64GB TGC Flash Memory), HDMI, WiFi, Webcam, Bluetooth,1-Year Microsoft 365 Win10 S",http://www.amazon.com/HP-Dual-Core-Processor-Bluetooth-Microsoft/dp/B092HFX4DN/ref=sr_1_44?dchild=1&keywords=laptop&qid=1634625300&refinements=p_n_condition-type%3A2224371011&rnid=2224369011&s=pc&sr=1-44
"2021 Newest HP Notebook 15 Laptop, 15.6"" Full HD Screen, Intel Celeron N4020 Processor, 8GB DDR4 Memory, 128GB SSD, 1-Year Microsoft Office 365, Webcam, Type-C, RJ-45, HDMI, Windows 10 Home, Black",http://www.amazon.com/HP-Notebook-Celeron-Processor-Microsoft/dp/B09BSKP98T/ref=sr_1_45?dchild=1&keywords=laptop&qid=1634625300&refinements=p_n_condition-type%3A2224371011&rnid=2224369011&s=pc&sr=1-45
"ASUS 15.6'' Touchscreen VivoBook Thin and Light Laptop | Intel Core i3-1005G1 (Beats i5-8250U) | Full HD, Fingerprint, Windows 10, Gray (8GB|256GB SSD, i3-1005G1)",http://www.amazon.com/ASUS-Touchscreen-VivoBook-i3-1005G1-Fingerprint/dp/B09GFP24RS/ref=sr_1_46?dchild=1&keywords=laptop&qid=1634625300&refinements=p_n_condition-type%3A2224371011&rnid=2224369011&s=pc&sr=1-46
"Windows 10 Pro Laptop, BiTECOOL 2021 New 14 inches HD Clear Display Pc Laptops, with Intel Celeron Dual Core, 6GB LPDDR4, 2.4G WiFi, BT4.0 and Long Lasting Battery, Mic (120GB SSD, J4005)",http://www.amazon.com/Windows-BiTECOOL-Display-Laptops-Celeron/dp/B09BNB8XXP/ref=sr_1_47?dchild=1&keywords=laptop&qid=1634625300&refinements=p_n_condition-type%3A2224371011&rnid=2224369011&s=pc&sr=1-47
"HP 15.6"" Full HD Touch-Screen Laptop, AMD Ryzen 7 4700U, 8GB Memory, 512GB SSD, Windows 10 Home, Natural Silver",http://www.amazon.com/HP-Touch-Screen-Laptop-Windows-Natural/dp/B092PZGYYV/ref=sr_1_48?dchild=1&keywords=laptop&qid=1634625300&refinements=p_n_condition-type%3A2224371011&rnid=2224369011&s=pc&sr=1-48
"2021 Newest Lenovo Ideapad 3 15.6” FHD Laptop, AMD Ryzen 5 5500U(up to 4.0GHz), 20GB RAM 512GB NVMe SSD, AMD Radeon 7 Graphics, up to 12 Hours, Webcam HDMI Win 10 Home, w/Ghost Manta Accessories",http://www.amazon.com/Newest-Lenovo-Ideapad-Graphics-Accessories/dp/B0991XPBB8/ref=sr_1_49?dchild=1&keywords=laptop&qid=1634625305&refinements=p_n_condition-type%3A2224371011&rnid=2224369011&s=pc&sr=1-49
"HP Chromebook 11-inch Laptop - Up to 15 Hour Battery Life - MediaTek - MT8183 - 4 GB RAM - 32 GB eMMC Storage - 11.6-inch HD Display - with Chrome OS - (11a-na0021nr, 2020 Model, Snow White)",http://www.amazon.com/HP-Chromebook-11-inch-Laptop-11a-na0021nr/dp/B08H6YZY3Y/ref=sr_1_50?dchild=1&keywords=laptop&qid=1634625305&refinements=p_n_condition-type%3A2224371011&rnid=2224369011&s=pc&sr=1-50
"HP 15 Inch Business and Student FHD IPS Display Laptop Intel Celeron N4020, Upto 9 Hours Battery Life Windows 10 S 8GB DDR4 RAM, 256GB SSD, with Woov HDMI Cable 1Year Office 365 Included",http://www.amazon.com/HP-Business-Student-Display-Included/dp/B09H72R5V2/ref=sr_1_51?dchild=1&keywords=laptop&qid=1634625305&refinements=p_n_condition-type%3A2224371011&rnid=2224369011&s=pc&sr=1-51
"Acer Swift 3 Intel Evo Thin & Light Laptop, 14"" Full HD, Intel Core i7-1165G7, Intel Iris Xe Graphics, 8GB LPDDR4X, 256GB NVMe SSD, Wi-Fi 6, Fingerprint Reader, Back-lit KB, SF314-59-75QC",http://www.amazon.com/Acer-i7-1165G7-Graphics-Fingerprint-SF314-59-75QC/dp/B08JQJ5RKK/ref=sr_1_52?dchild=1&keywords=laptop&qid=1634625305&refinements=p_n_condition-type%3A2224371011&rnid=2224369011&s=pc&sr=1-52
"2020 Apple MacBook Air Laptop: Apple M1 Chip, 13” Retina Display, 8GB RAM, 256GB SSD Storage, Backlit Keyboard, FaceTime HD Camera, Touch ID. Works with iPhone/iPad; Gold",http://www.amazon.com/Apple-MacBook-13-inch-256GB-Storage/dp/B08N5M7S6K/ref=sr_1_53?dchild=1&keywords=laptop&qid=1634625305&refinements=p_n_condition-type%3A2224371011&rnid=2224369011&s=pc&sr=1-53
"2021 Newest HP 14"" Ultra Light Laptop, Intel N4020 Processor(Up to 2.8GHz), 4GB RAM, 128GB Storage(64GB eMMC+64GB Micro SD), 1 Year Office 365, Webcam, HDMI, WiFi, USB-A&C, Google Classroom or Zoom",http://www.amazon.com/Newest-HP-Processor-Storage-Classroom/dp/B098K1XX1S/ref=sr_1_54?dchild=1&keywords=laptop&qid=1634625305&refinements=p_n_condition-type%3A2224371011&rnid=2224369011&s=pc&sr=1-54
"2021 Newest Dell Inspiron 3000 Laptop Computer, 15.6 Inch HD Display, Intel Pentium Processor N5030 (Up to 3.10Ghz), 16GB RAM, 512GB SSD, Webcam, Wi-Fi, HDMI, Windows 10 Home, Black (Latest Model)",http://www.amazon.com/Dell-Inspiron-Computer-Display-Processor/dp/B091V195LZ/ref=sr_1_55?dchild=1&keywords=laptop&qid=1634625305&refinements=p_n_condition-type%3A2224371011&rnid=2224369011&s=pc&sr=1-55
"HP Premium Laptop (2021 Latest Model), 14"" HD Touchscreen, AMD Athlon Processor, 8GB RAM, 192GB SSD, Long Battery Life, Online Conferencing, Natural Silver, Win 10 with 1 Year of Microsoft 365",http://www.amazon.com/HP-Premium-Touchscreen-Processor-Conferencing/dp/B096YTPFX3/ref=sr_1_56?dchild=1&keywords=laptop&qid=1634625305&refinements=p_n_condition-type%3A2224371011&rnid=2224369011&s=pc&sr=1-56
"HP Stream 14-inch Laptop, Intel Celeron N4000, 4 GB RAM, 64 GB eMMC, Windows 10 Home in S Mode with Office 365 Personal for 1 Year (14-cb186nr, Brilliant Black) (9MV74UA#ABA)",http://www.amazon.com/HP-14-cb186nr-Brilliant-9MV74UA-ABA/dp/B084SMMH96/ref=sr_1_57?dchild=1&keywords=laptop&qid=1634625305&refinements=p_n_condition-type%3A2224371011&rnid=2224369011&s=pc&sr=1-57
"TECLAST Gaming Laptop, Intel Core i5-8259U, 15.6 Inch FHD Matte IPS Traditional Windows 10 Laptops Computers, 8GB RAM 256GB SSD, Super Silent Cooling, Backlit, Fast Charge, Long Battery Life",http://www.amazon.com/TECLAST-i5-8259U-Traditional-Windows-Computers/dp/B09DK9RBR3/ref=sr_1_58?dchild=1&keywords=laptop&qid=1634625305&refinements=p_n_condition-type%3A2224371011&rnid=2224369011&s=pc&sr=1-58
"Acer Swift X SFX14-41G-R1S6 Creator Laptop | 14"" Full HD 100% sRGB | AMD Ryzen 7 5800U | NVIDIA RTX 3050Ti Laptop GPU | 16GB LPDDR4X | 512GB SSD | Wi-Fi 6 | Backlit KB | Amazon Alexa | Windows 10 Home",http://www.amazon.com/Acer-SFX14-41G-R1S6-Creator-LPDDR4X-Backlit/dp/B093TK1PXF/ref=sr_1_59?dchild=1&keywords=laptop&qid=1634625305&refinements=p_n_condition-type%3A2224371011&rnid=2224369011&s=pc&sr=1-59
Dell Inspiron 15 3000 15.6-inch Full HD 11th Gen Intel Core i5-1135G7 12GB 256GB SSD Laptop,http://www.amazon.com/Dell-Inspiron-15-6-inch-i5-1135G7-Laptop/dp/B095RZ62BX/ref=sr_1_60?dchild=1&keywords=laptop&qid=1634625305&refinements=p_n_condition-type%3A2224371011&rnid=2224369011&s=pc&sr=1-60
"Dell Inspiron 15 3000 Business and Student Laptop (2021 Latest Model), 15.6"" HD Display, Intel N4020 Dual-Core Processor, 8GB RAM, 256GB SSD, Webcam, HDMI, Bluetooth, Wi-Fi, Black, Windows 10",http://www.amazon.com/Dell-Inspiron-Dual-Core-Processor-Bluetooth/dp/B09DM1TWHF/ref=sr_1_61?dchild=1&keywords=laptop&qid=1634625305&refinements=p_n_condition-type%3A2224371011&rnid=2224369011&s=pc&sr=1-61
"Lenovo IdeaPad 3 Laptop, 15.6"" FHD Display, Intel Dual-Core Processor, Intel UHD Graphics, 8GB RAM, 256GB SSD, Webcam, HDMI, Bluetooth 5.0, Long Battery Life, Almond, Win 10",http://www.amazon.com/Lenovo-IdeaPad-Dual-Core-Processor-Bluetooth/dp/B09H8MPQMY/ref=sr_1_62?dchild=1&keywords=laptop&qid=1634625305&refinements=p_n_condition-type%3A2224371011&rnid=2224369011&s=pc&sr=1-62
"Lenovo Flex 5 14"" 2-in-1 Laptop, 14.0"" FHD (1920 x 1080) Touch Display, AMD Ryzen 5 4500U Processor, 16GB DDR4, 256GB SSD, AMD Radeon Graphics, Digital Pen Included, Win 10, 81X20005US, Graphite Grey",http://www.amazon.com/Lenovo-Processor-Graphics-Included-81X20005US/dp/B086226DDB/ref=sr_1_63?dchild=1&keywords=laptop&qid=1634625305&refinements=p_n_condition-type%3A2224371011&rnid=2224369011&s=pc&sr=1-63
"2021 Newest Gateway 15.6"" FHD Ultra Slim Laptop, AMD Ryzen 5 3450U (Better Than i7-8565U), 16GB RAM, 1TB SSD, THX Audio, Fingerprint Scanner, Webcam, HDMI, WiFi, Windows 10 Home, Purple+Oydisen Cloth",http://www.amazon.com/Gateway-i7-8565U-Fingerprint-Scanner-Windows/dp/B099M1HGTH/ref=sr_1_64?dchild=1&keywords=laptop&qid=1634625305&refinements=p_n_condition-type%3A2224371011&rnid=2224369011&s=pc&sr=1-64
"2021 Newest Dell Inspiron 3000 Business Laptop, 15.6 HD LED-Backlit Display, Intel Celeron Processor N4020, 16GB DDR4 RAM, 1TB Hard Disk Drive, Online Meeting Ready, Webcam, HDMI, Win10 Pro, Black",http://www.amazon.com/Dell-Inspiron-Business-LED-Backlit-Processor/dp/B08X15RQSC/ref=sr_1_65?dchild=1&keywords=laptop&qid=1634625305&refinements=p_n_condition-type%3A2224371011&rnid=2224369011&s=pc&sr=1-65
"ASUS VivoBook 15 F515 Thin and Light Laptop, 15.6” FHD Display, Intel Core i3-1005G1 Processor, 4GB DDR4 RAM, 128GB PCIe SSD, Fingerprint Reader, Windows 10 Home in S Mode, Slate Grey, F515JA-AH31",http://www.amazon.com/ASUS-i3-1005G1-Processor-Fingerprint-F515JA-AH31/dp/B08H4YTTLP/ref=sr_1_66?dchild=1&keywords=laptop&qid=1634625305&refinements=p_n_condition-type%3A2224371011&rnid=2224369011&s=pc&sr=1-66
