Name,URL
"ASUS ZenBook 14 Ultra-Slim Laptop 14” FHD NanoEdge Bezel Display, Intel Core i7-1165G7, NVIDIA MX450, 16GB RAM, 512GB SSD, ScreenPad 2.0, Thunderbolt 4, Windows 10 Pro, Pine Grey, UX435EG-XH74",http://www.amazon.com/ASUS-Ultra-Slim-i7-1165G7-Thunderbolt-UX435EG-XH74/dp/B08KH3Z5WW/ref=sr_1_538?dchild=1&keywords=laptop&qid=1634625378&refinements=p_n_condition-type%3A2224371011&rnid=2224369011&s=pc&sr=1-538
"2021 Lenovo IdeaPad 3 15 Laptop, AMD Ryzen 5 5500U(Beat i7-10710U) 12GB RAM 256GB SSD, 15.6"" FHD Display, Backlit Keyboard, FP Reader, Webcam, Lightweight, Win 10-Free Windows 11 Upgrade, VAATE Kit",http://www.amazon.com/Lenovo-Laptop-i7-10710U-Keyboard-Lightweight/dp/B09CWVLJ7R/ref=sr_1_539?dchild=1&keywords=laptop&qid=1634625378&refinements=p_n_condition-type%3A2224371011&rnid=2224369011&s=pc&sr=1-539
"2021 Newest HP Chromebook 14"" HD Laptop for Business and Student, Intel Celeron N4000, 4GB RAM, 32GB eMMC, Backlit-KB, Webcam, Fast Charge, WiFi, Bluetooth, USB-A&C, Chrome OS, w/GM Accessories",http://www.amazon.com/HP-Chromebook-Backlit-KB-Bluetooth-Accessories/dp/B08HYWWD6W/ref=sr_1_540?dchild=1&keywords=laptop&qid=1634625378&refinements=p_n_condition-type%3A2224371011&rnid=2224369011&s=pc&sr=1-540
"Asus Vivobook L510 15.6” FHD Ultra Thin Premium Business Laptop, Intel Celeron N4020, 4GB DDR4, 64GB eMMC, Backlit KB, Fingerprint, USB-C, HDMI, Windows 10 S, 1-Yr Office 365, ABYS 64GB MicroSD Card",http://www.amazon.com/Vivobook-L510-Premium-Business-Fingerprint/dp/B09C5GFY1P/ref=sr_1_541?dchild=1&keywords=laptop&qid=1634625378&refinements=p_n_condition-type%3A2224371011&rnid=2224369011&s=pc&sr=1-541
"2021 HP 15.6 FHD IPS Touchscreen Laptop, Intel Core i7-1065G7 Processor, 12GB Memory, 256GB SSD, HDMI, Intel Iris Plus Graphics, WiFi, Webcam, Bluetooth, Windows 10 Home, Silver",http://www.amazon.com/HP-Touchscreen-i7-1065G7-Processor-Accessories/dp/B08WRBTD1G/ref=sr_1_542?dchild=1&keywords=laptop&qid=1634625378&refinements=p_n_condition-type%3A2224371011&rnid=2224369011&s=pc&sr=1-542
"2021 Newest HP Stream 14"" HD SVA Laptop Computer, Intel Celeron N4000 Processor, 16GB RAM, 320GB Space(64GB eMMC+256GB MSD), Office 365, HDMI, Bluetooth, Windows 10, Pink, AllyFlex MP, Online Class",http://www.amazon.com/HP-14-Computer-Processor-Bluetooth/dp/B097QKDGBQ/ref=sr_1_543?dchild=1&keywords=laptop&qid=1634625378&refinements=p_n_condition-type%3A2224371011&rnid=2224369011&s=pc&sr=1-543
"2021 Dell Inspiron 15 3000 15.6"" HD Laptop Computer, Intel Celeron Processor 4205U, 4GB RAM, 128GB PCIe SSD, Intel UHD Graphics 610, Waves MaxxAudio, HD Webcam, Windows 10, Black",http://www.amazon.com/Dell-Inspiron-Computer-Processor-MaxxAudio/dp/B08XWLTKD1/ref=sr_1_544?dchild=1&keywords=laptop&qid=1634625378&refinements=p_n_condition-type%3A2224371011&rnid=2224369011&s=pc&sr=1-544
"2019 Dell Inspiron 3593 Laptop 15.6"", 10th Generation Intel Core i5-1035G1 Processor, 8GB DDR4 RAM 256GB Solid State Drive, HDMI, WiFi, Bluetooth, Windows 10, Black",http://www.amazon.com/Dell-Generation-i5-1035G1-Processor-Bluetooth/dp/B07YXWWMRL/ref=sr_1_545?dchild=1&keywords=laptop&qid=1634625378&refinements=p_n_condition-type%3A2224371011&rnid=2224369011&s=pc&sr=1-545
"HP Chromebook 14"" Touchscreen Laptop Computer for Student_ Intel Celeron N3350 up to 2.4GHz_ 4GB DDR4 RAM_ 32GB eMMC_ AC WiFi_ Type-C_ Webcam_ Chrome OS_ BROAGE 64GB Flash Stylus_ Online Class Ready",http://www.amazon.com/HP-Chromebook-Touchscreen-Computer-Student_/dp/B088KMMGNC/ref=sr_1_546?dchild=1&keywords=laptop&qid=1634625378&refinements=p_n_condition-type%3A2224371011&rnid=2224369011&s=pc&sr=1-546
"2021 Lenovo ThinkPad E15 Gen3 15.6"" FHD (1920x1080) Business Laptop (AMD 8-Core Ryzen 7 5700u (Beat i7-10750H), 16GB DDR4, 256GB PCIe SSD) Type-C, WiFi 6, Webcam, Windows 10 Pro + HDMI Cable",http://www.amazon.com/Lenovo-ThinkPad-E15-Gen3-1920x1080/dp/B09BC96KFB/ref=sr_1_547?dchild=1&keywords=laptop&qid=1634625378&refinements=p_n_condition-type%3A2224371011&rnid=2224369011&s=pc&sr=1-547
"ASUS VivoBook 15 F515 Thin and Light Laptop, 15.6” FHD Display,Core i5-1135G7 Processor, Iris Xe Graphics, 8GB DDR4 RAM, 512GB SSD, Fingerprint, Windows 10 Home, Slate Grey, F515EA-DB55",http://www.amazon.com/ASUS-i5-1135G7-Processor-Fingerprint-F515EA-DB55/dp/B09C18PVYJ/ref=sr_1_548?dchild=1&keywords=laptop&qid=1634625378&refinements=p_n_condition-type%3A2224371011&rnid=2224369011&s=pc&sr=1-548
"Gateway 15.6"" FHD Ultra Slim Laptop Computer_ Quad-Core AMD Ryzen 5 3450U up to 3.5GHz (Beat i5-8365U)_ 16GB DDR4 RAM_ 256GB SSD_ Fingerprint Scanner_ HDMI_ Windows 10_ 64GB Flash Drive_ Blue",http://www.amazon.com/Gateway-Computer_-Quad-Core-i5-8365U-Fingerprint/dp/B091T425J1/ref=sr_1_549?dchild=1&keywords=laptop&qid=1634625378&refinements=p_n_condition-type%3A2224371011&rnid=2224369011&s=pc&sr=1-549
"HP 17 17.3"" FHD Laptop Computer, 11th Gen Intel Quad-Core i5-1135G7 up to 4.2GHz (Beat i7-1065G7), 8GB DDR4 RAM, 512GB PCIe SSD, AC WiFi, Bluetooth 4.2, Windows 10, BROAGE 500GB External Hard Drive",http://www.amazon.com/HP-Computer_-Quad-Core-i7-7500u-Microphone_/dp/B089M9FNML/ref=sr_1_550?dchild=1&keywords=laptop&qid=1634625378&refinements=p_n_condition-type%3A2224371011&rnid=2224369011&s=pc&sr=1-550
"HP 14"" HD SVA Micro-edge WLED-backlit Laptop PC, AMD Ryzen 3 3250U Processor, 16GB DDR4, 512GB SSD, AMD Radeon Vega 3 Graphics, HDMI, Windows 10 S, Google Classroom Compatible, 64GB ABYS Micro SD Card",http://www.amazon.com/HP-Micro-edge-WLED-backlit-Processor-Compatible/dp/B08SK376RB/ref=sr_1_551?dchild=1&keywords=laptop&qid=1634625378&refinements=p_n_condition-type%3A2224371011&rnid=2224369011&s=pc&sr=1-551
"HP 14"" Ryzen 3 4GB/128GB Laptop-Silver (Google Classroom Compatible)",http://www.amazon.com/HP-Laptop-Silver-Google-Classroom-Compatible/dp/B08HCMWMPS/ref=sr_1_552?dchild=1&keywords=laptop&qid=1634625378&refinements=p_n_condition-type%3A2224371011&rnid=2224369011&s=pc&sr=1-552
"CHUWI HeroBook Air 11.6"" Laptop, Intel Celeron N4020 Processor, 128GB Storage, 4GB DDR4 RAM, HD Display, WiFi, Webcam, Thin and Light Windows 10 Home Notebook",http://www.amazon.com/CHUWI-HeroBook-Air-Processor-Notebook/dp/B09B78RSVL/ref=sr_1_553?dchild=1&keywords=laptop&qid=1634625382&refinements=p_n_condition-type%3A2224371011&rnid=2224369011&s=pc&sr=1-553
"Dell 9310 XPS 2 in 1 Convertible, 13.4 Inch FHD+ Touchscreen Laptop, Intel Core i7-1165G7, 32GB 4267MHz LPDDR4x RAM, 512GB SSD, Intel Iris Xe Graphics, Windows 10 Home - Platinum Silver (Latest Model)",http://www.amazon.com/Dell-Convertible-Touchscreen-i7-1165G7-Graphics/dp/B08LKTW8WP/ref=sr_1_554?dchild=1&keywords=laptop&qid=1634625382&refinements=p_n_condition-type%3A2224371011&rnid=2224369011&s=pc&sr=1-554
"HP Notebook - 14-cf1008ca 14"" Intel Core i5-8265U 1.6 GHz 8 GB RAM 256 GB SSD Storage Windows 10H BT Webcam Silver",http://www.amazon.com/HP-Notebook-14-cf1008ca-i5-8265U-Storage/dp/B0949RGZVC/ref=sr_1_555?dchild=1&keywords=laptop&qid=1634625382&refinements=p_n_condition-type%3A2224371011&rnid=2224369011&s=pc&sr=1-555
"Emerald Computers Rugged Laptop with I7-8550U Quad Core, 8 Thread CPU, 16GB RAM 512GB SSD, 13.3 Inch 1080p Screen, Tenacious Model in Gun Metal Gray",http://www.amazon.com/Rugged-Laptop-I7-8550U-Thread-Tenacious/dp/B091874GLT/ref=sr_1_556?dchild=1&keywords=laptop&qid=1634625382&refinements=p_n_condition-type%3A2224371011&rnid=2224369011&s=pc&sr=1-556
"HP 15.6"" FHD, Ryzen 5-5500, 8GB RAM, 256GB SSD, Silver, Windows 10 Home, 15-EF2127",http://www.amazon.com/HP-5-5500-Silver-Windows-15-EF2127/dp/B09BMGCVZH/ref=sr_1_557?dchild=1&keywords=laptop&qid=1634625382&refinements=p_n_condition-type%3A2224371011&rnid=2224369011&s=pc&sr=1-557
Dell Latitude 3190 Premium Business 11 2-in-1 Laptop I 11.6” HD Toucscreen I Intel 4-Core Celeron N4120 I 4GB RAM 64GB eMMC I Office365 Win10Pro Black,http://www.amazon.com/Dell-Latitude-3190-Laptop-Toucscreen/dp/B097PWMFBH/ref=sr_1_558?dchild=1&keywords=laptop&qid=1634625382&refinements=p_n_condition-type%3A2224371011&rnid=2224369011&s=pc&sr=1-558
"ASUS TUF Gaming F17 Gaming Laptop, 17.3” 144Hz Full HD IPS-Type, Intel Core i7-11800H Processor, GeForce RTX 3060, 16GB DDR4, 1TB PCIe SSD, Gigabit Wi-Fi 6, Windows 10 Home, TUF706HM-ES76",http://www.amazon.com/ASUS-IPS-Type-i7-11800H-Processor-TUF706HM-ES76/dp/B096V6RZ22/ref=sr_1_559?dchild=1&keywords=laptop&qid=1634625382&refinements=p_n_condition-type%3A2224371011&rnid=2224369011&s=pc&sr=1-559
"ASUS Vivobook 17 17.3"" HD+ Laptop Computer, Intel Quard-Core i7 1065G7 up to 3.9GHz, 40GB DDR4 RAM, 2TB PCIe SSD, AC WiFi, Bluetooth, Webcam, Silver, Windows 10 S, BROAGE 320GB External Hard Drive",http://www.amazon.com/ASUS-Vivobook-17-Quard-Core-Bluetooth/dp/B096RJSYVJ/ref=sr_1_560?dchild=1&keywords=laptop&qid=1634625382&refinements=p_n_condition-type%3A2224371011&rnid=2224369011&s=pc&sr=1-560
"VivoBook 17 17.3"" Laptop - AMD Ryzen 7 - 12GB Memory - AMD Radeon RX Vega 10 - 512GB SSD - Transparent Silver Model:X712DA-BR7N6SKU:6403423",http://www.amazon.com/VivoBook-17-3-Laptop-Transparent-X712DA-BR7N6SKU/dp/B087ZNP8FL/ref=sr_1_561?dchild=1&keywords=laptop&qid=1634625382&refinements=p_n_condition-type%3A2224371011&rnid=2224369011&s=pc&sr=1-561
"Acer Chromebook Spin 311 Convertible 2-in-1 Laptop, MediaTek MT8183C Octa-Core Processor, 11.6in HD Touch, 4GB LPDDR4, 32GB eMMC, Gigabit, WiFi 5, Bluetooth, Google Chrome",http://www.amazon.com/Acer-Chromebook-Convertible-Octa-Core-Processor/dp/B098Z1PPTZ/ref=sr_1_562?dchild=1&keywords=laptop&qid=1634625382&refinements=p_n_condition-type%3A2224371011&rnid=2224369011&s=pc&sr=1-562
Laptop 15.6-inch Celeron_j3455 Quad Core 6GB RAM 128GB SSD Full HD Display with Dual WiFi Mini HDMI Windows 10,http://www.amazon.com/Laptop-15-6-inch-Celeron_j3455-Display-Windows/dp/B092ZXVZ8S/ref=sr_1_563?dchild=1&keywords=laptop&qid=1634625382&refinements=p_n_condition-type%3A2224371011&rnid=2224369011&s=pc&sr=1-563
"HP 2019 14"" Laptop - Intel Core i3 - 8GB Memory - 128GB Solid State Drive - Ash Silver Keyboard Frame (14-CF0014DX)",http://www.amazon.com/HP-2019-14-Laptop-14-CF0014DX/dp/B07KNLVRJ2/ref=sr_1_564?dchild=1&keywords=laptop&qid=1634625382&refinements=p_n_condition-type%3A2224371011&rnid=2224369011&s=pc&sr=1-564
"ASUS VivoBook 17 F712DA Thin and Light Laptop, 17.3” HD+, Intel Core i5-8265U Processor, 8GB DDR4 RAM, 128GB SSD + 1TB HDD, Windows 10 Home, Transparent Silver, F712DA-DB51",http://www.amazon.com/Vivobook-I5-8265U-Processor-Transparent-F712FA-DB51/dp/B07S2M99LF/ref=sr_1_565?dchild=1&keywords=laptop&qid=1634625382&refinements=p_n_condition-type%3A2224371011&rnid=2224369011&s=pc&sr=1-565
"2021 Newest Dell Inspiron 7000 2-in-1 Premium Laptop, 17"" QHD+ Touch Display, Intel Core i5-1135G7, 16GB RAM, 1TB PCie SSD, Intel Iris Xe Graphics, HDMI, Webcam, Backlit KB, FP Reader, Win10 Home",http://www.amazon.com/Dell-Inspiron-Premium-i5-1135G7-Graphics/dp/B091BFK7WS/ref=sr_1_566?dchild=1&keywords=laptop&qid=1634625382&refinements=p_n_condition-type%3A2224371011&rnid=2224369011&s=pc&sr=1-566
"Lenovo Ideapad 3 15.6"" Touchscreen Laptop Computer, Intel Core i3 10110U up to 4.1GHz, 8GB DDR4 RAM, 256GB PCIe SSD, 802.11AC WiFi, Bluetooth 5.0, Abyss Blue, Windows 10 S, BROAGE 64GB Flash Stylus",http://www.amazon.com/Lenovo-Ideapad-Computer_-i3-1005G1_-802-11AC/dp/B084M5RNHQ/ref=sr_1_567?dchild=1&keywords=laptop&qid=1634625382&refinements=p_n_condition-type%3A2224371011&rnid=2224369011&s=pc&sr=1-567
"2020 Lenovo Yoga C740 14"" FHD IPS Touchscreen Premium 2-in-1 Laptop, 10th Gen Intel Quad Core i5-10210U, 8GB RAM, 256GB PCIe SSD, Backlit Keyboard, Fingerprint Reader, Windows 10, Aluminum Chassis",http://www.amazon.com/Lenovo-Touchscreen-i5-10210U-Keyboard-Fingerprint/dp/B08BNZ5NTG/ref=sr_1_568?dchild=1&keywords=laptop&qid=1634625382&refinements=p_n_condition-type%3A2224371011&rnid=2224369011&s=pc&sr=1-568
"2021 HP 14"" HD Laptop, Intel Celeron N4020 Processor, 4GB RAM, 64GB eMMC, Webcam, HDMI, Windows 10 S, 1 Year Office 365 , Google Classroom or Zoom Compatible, MD Accessories (Rose Gold)",http://www.amazon.com/HP-Processor-Classroom-Compatible-Accessories/dp/B097GBQZS6/ref=sr_1_569?dchild=1&keywords=laptop&qid=1634625382&refinements=p_n_condition-type%3A2224371011&rnid=2224369011&s=pc&sr=1-569
"MSI GF75 Thin Gaming Laptop, 17.3"" FHD 144Hz IPS Screen,Intel Core i5-10300H Processor Up to 4.50 GHz, NVIDIA GTX 1650Ti Graphics, 8GB RAM,512GB PCIe SSD, Win10 Home+2weeks SkyCare Support",http://www.amazon.com/MSI-i5-10300H-Processor-Graphics-SkyCare/dp/B0916GR3Z5/ref=sr_1_570?dchild=1&keywords=laptop&qid=1634625382&refinements=p_n_condition-type%3A2224371011&rnid=2224369011&s=pc&sr=1-570
"HP 15 Laptop, 15.6"" HD Display, Intel Core I5-8265U, Intel UHD Graphics, 8GB, 256GB SSD, Natural Silver",http://www.amazon.com/HP-Display-I5-8265U-Graphics-Natural/dp/B07T4LQ7L2/ref=sr_1_571?dchild=1&keywords=laptop&qid=1634625382&refinements=p_n_condition-type%3A2224371011&rnid=2224369011&s=pc&sr=1-571
"Gateway 15.6"" FHD Ultra Slim Laptop Computer_ Quad-Core AMD Ryzen 5 3450U up to 3.5GHz (Beat i5-8365U)_ 16GB DDR4 RAM_ 256GB SSD_ Fingerprint Scanner_ HDMI_ Windows 10_ 64GB Flash Drive_ Blue",http://www.amazon.com/Gateway-Computer_-Quad-Core-i5-8365U-Fingerprint/dp/B091T425J1/ref=sr_1_572?dchild=1&keywords=laptop&qid=1634625382&refinements=p_n_condition-type%3A2224371011&rnid=2224369011&s=pc&sr=1-572
"Lenovo IdeaPad Flex 5 2-in-1 Laptop, 14"" Full HD IPS Touch Screen, AMD Ryzen 7 4700U, Webcam, Backlit Keyboard, Fingerprint Reader, USB-C, HDMI, Windows 10 Home, 16GB RAM, 512GB PCIe SSD",http://www.amazon.com/Lenovo-IdeaPad-Flex-Keyboard-Fingerprint/dp/B08SMFZSLQ/ref=sr_1_573?dchild=1&keywords=laptop&qid=1634625382&refinements=p_n_condition-type%3A2224371011&rnid=2224369011&s=pc&sr=1-573
"2021 Newest HP 15 15.6"" FHD Laptop Computer, Intel Core i3 1115G4 up to 3.2GHz (Beat i5-8365U), 8GB DDR4 RAM, 256GB PCIe SSD, 802.11AC WiFi, Bluetooth 4.2, Webcam, Windows 10 S, iPuzzle Type-C HUB",http://www.amazon.com/HP-Micro-Edge-Computer-i5-7200U-Bluetooth/dp/B0869CSDJR/ref=sr_1_574?dchild=1&keywords=laptop&qid=1634625382&refinements=p_n_condition-type%3A2224371011&rnid=2224369011&s=pc&sr=1-574
"2021 Newest Dell Inspiron 15 3505 15.6 FHD LED-Backlit Laptop, AMD Ryzen 3 3250U up to 3.5GHz, 8GB DDR4, 256GB SSD, Online Meeting Ready, Webcam, HDMI, Fingerprint Reader, Windows 10 S",http://www.amazon.com/Dell-Inspiron-15-LED-Backlit-Fingerprint/dp/B09HN4DHF9/ref=sr_1_575?dchild=1&keywords=laptop&qid=1634625382&refinements=p_n_condition-type%3A2224371011&rnid=2224369011&s=pc&sr=1-575
"Acer - Nitro 5 15.6"" Laptop - AMD Ryzen 5 - 8GB Memory - NVIDIA GeForce GTX 1650 - 256GB SSD - Obsidian Black",http://www.amazon.com/Acer-Laptop-Memory-GeForce-Obsidian/dp/B08B4BF23G/ref=sr_1_576?dchild=1&keywords=laptop&qid=1634625382&refinements=p_n_condition-type%3A2224371011&rnid=2224369011&s=pc&sr=1-576
"2021 HP 14"" HD Laptop, Intel Celeron N4020 Processor, 4GB RAM, 64GB eMMC, Webcam, HDMI, Windows 10 S, 1 Year Office 365 , Google Classroom or Zoom Compatible, MD Accessories (Rose Gold)",http://www.amazon.com/HP-Processor-Classroom-Compatible-Accessories/dp/B097GBQZS6/ref=sr_1_577?dchild=1&keywords=laptop&qid=1634625386&refinements=p_n_condition-type%3A2224371011&rnid=2224369011&s=pc&sr=1-577
"Newest Acer Nitro 5 Gaming Laptop, NVIDIA GeForce GTX 1650, Core i5-9300H, 15.6"" FHD IPS, Windows 10 H, Waves MaxxAudio, Cool Boost, WiFi 6, Type-C, Accessory(16GB RAM | 512GB PCIe SSD)",http://www.amazon.com/Acer-Nitro-i5-9300H-MaxxAudio-Accessory/dp/B09B2WSGY8/ref=sr_1_578?dchild=1&keywords=laptop&qid=1634625386&refinements=p_n_condition-type%3A2224371011&rnid=2224369011&s=pc&sr=1-578
"Lenovo Ideapad 3 15.6"" Touchscreen Laptop Computer, Intel Core i3 10110U up to 4.1GHz, 8GB DDR4 RAM, 256GB PCIe SSD, 802.11AC WiFi, Bluetooth 5.0, Abyss Blue, Windows 10 S, BROAGE 64GB Flash Stylus",http://www.amazon.com/Lenovo-Ideapad-Computer_-i3-1005G1_-802-11AC/dp/B084M5RNHQ/ref=sr_1_579?dchild=1&keywords=laptop&qid=1634625386&refinements=p_n_condition-type%3A2224371011&rnid=2224369011&s=pc&sr=1-579
"2021 HP Stream 14"" HD Thin and Light Laptop, Intel Celeron N4020 Processor, 4GB Memory, 64GB eMMC Storage, WiFi 5, Webcam, HDMI, 1 Year Office 365, Windows 10 S, Rose Gold",http://www.amazon.com/HP-Celeron-Processor-Storage-Windows/dp/B09313QL4G/ref=sr_1_580?dchild=1&keywords=laptop&qid=1634625386&refinements=p_n_condition-type%3A2224371011&rnid=2224369011&s=pc&sr=1-580
"2020 Lenovo Yoga C740 14"" FHD IPS Touchscreen Premium 2-in-1 Laptop, 10th Gen Intel Quad Core i5-10210U, 8GB RAM, 256GB PCIe SSD, Backlit Keyboard, Fingerprint Reader, Windows 10, Aluminum Chassis",http://www.amazon.com/Lenovo-Touchscreen-i5-10210U-Keyboard-Fingerprint/dp/B08BNZ5NTG/ref=sr_1_581?dchild=1&keywords=laptop&qid=1634625386&refinements=p_n_condition-type%3A2224371011&rnid=2224369011&s=pc&sr=1-581
"2021 Newest Acer Aspire 3 17.3'' HD+ Laptop, 4-core Intel i5-1035G1(up to 3.60 GHz), 20GB RAM 1TB HDD+256GB PCIe SSD, HDMI WiFi RJ-45 Bluetooth Webcam DVD-RW, Win 10 w/Ghost Manta Accessories",http://www.amazon.com/Newest-Acer-i5-1035G1-Bluetooth-Accessories/dp/B09CD5FH33/ref=sr_1_582?dchild=1&keywords=laptop&qid=1634625386&refinements=p_n_condition-type%3A2224371011&rnid=2224369011&s=pc&sr=1-582
"MSI GF75 Thin Gaming Laptop, 17.3"" FHD 144Hz IPS Screen,Intel Core i5-10300H Processor Up to 4.50 GHz, NVIDIA GTX 1650Ti Graphics, 8GB RAM,512GB PCIe SSD, Win10 Home+2weeks SkyCare Support",http://www.amazon.com/MSI-i5-10300H-Processor-Graphics-SkyCare/dp/B0916GR3Z5/ref=sr_1_583?dchild=1&keywords=laptop&qid=1634625386&refinements=p_n_condition-type%3A2224371011&rnid=2224369011&s=pc&sr=1-583
"HP 15 Laptop, 15.6"" HD Display, Intel Core I5-8265U, Intel UHD Graphics, 8GB, 256GB SSD, Natural Silver",http://www.amazon.com/HP-Display-I5-8265U-Graphics-Natural/dp/B07T4LQ7L2/ref=sr_1_584?dchild=1&keywords=laptop&qid=1634625386&refinements=p_n_condition-type%3A2224371011&rnid=2224369011&s=pc&sr=1-584
"HP Notebook - 14-cf1008ca 14"" Intel Core i5-8265U 1.6 GHz 8 GB RAM 256 GB SSD Storage Windows 10H BT Webcam Silver",http://www.amazon.com/HP-Notebook-14-cf1008ca-i5-8265U-Storage/dp/B0949RGZVC/ref=sr_1_585?dchild=1&keywords=laptop&qid=1634625386&refinements=p_n_condition-type%3A2224371011&rnid=2224369011&s=pc&sr=1-585
"Lenovo IdeaPad Flex 5 2-in-1 Laptop, 14"" Full HD IPS Touch Screen, AMD Ryzen 7 4700U, Webcam, Backlit Keyboard, Fingerprint Reader, USB-C, HDMI, Windows 10 Home, 16GB RAM, 512GB PCIe SSD",http://www.amazon.com/Lenovo-IdeaPad-Flex-Keyboard-Fingerprint/dp/B08SMFZSLQ/ref=sr_1_586?dchild=1&keywords=laptop&qid=1634625386&refinements=p_n_condition-type%3A2224371011&rnid=2224369011&s=pc&sr=1-586
"2021 Newest HP 15 15.6"" FHD Laptop Computer, Intel Core i3 1115G4 up to 3.2GHz (Beat i5-8365U), 8GB DDR4 RAM, 256GB PCIe SSD, 802.11AC WiFi, Bluetooth 4.2, Webcam, Windows 10 S, iPuzzle Type-C HUB",http://www.amazon.com/HP-Micro-Edge-Computer-i5-7200U-Bluetooth/dp/B0869CSDJR/ref=sr_1_587?dchild=1&keywords=laptop&qid=1634625386&refinements=p_n_condition-type%3A2224371011&rnid=2224369011&s=pc&sr=1-587
"2021 Newest Dell Inspiron 15 3505 15.6 FHD LED-Backlit Laptop, AMD Ryzen 3 3250U up to 3.5GHz, 8GB DDR4, 256GB SSD, Online Meeting Ready, Webcam, HDMI, Fingerprint Reader, Windows 10 S",http://www.amazon.com/Dell-Inspiron-15-LED-Backlit-Fingerprint/dp/B09HN4DHF9/ref=sr_1_588?dchild=1&keywords=laptop&qid=1634625386&refinements=p_n_condition-type%3A2224371011&rnid=2224369011&s=pc&sr=1-588
"Acer - Nitro 5 15.6"" Laptop - AMD Ryzen 5 - 8GB Memory - NVIDIA GeForce GTX 1650 - 256GB SSD - Obsidian Black",http://www.amazon.com/Acer-Laptop-Memory-GeForce-Obsidian/dp/B08B4BF23G/ref=sr_1_589?dchild=1&keywords=laptop&qid=1634625386&refinements=p_n_condition-type%3A2224371011&rnid=2224369011&s=pc&sr=1-589
"HP Laptop 14 inch HD Screen, Intel Celeron N4020 Processor, 4GB DDR4 Memory, 64GB eMMC, Webcam Bluetooth,1-Year Microsoft 365, Online Class/Online Meeting, Windows 10 Home S, iMei 64GB Micro SD Card",http://www.amazon.com/HP-Celeron-Processor-Bluetooth-Microsoft/dp/B08RWJXXNY/ref=sr_1_590?dchild=1&keywords=laptop&qid=1634625386&refinements=p_n_condition-type%3A2224371011&rnid=2224369011&s=pc&sr=1-590
"LG Gram 15Z90P – 15.6"" Full HD IPS (1920x1080) Ultra-Lightweight Laptop, with 11th Gen Intel Core i5-1135G7 CPU, 8GB RAM, 512GB SSD, Up to 21 Hour Battery, Thunderbolt 4, Black – 2021",http://www.amazon.com/LG-Gram-15Z90P-Ultra-Lightweight-Thunderbolt/dp/B0942BQLLY/ref=sr_1_591?dchild=1&keywords=laptop&qid=1634625386&refinements=p_n_condition-type%3A2224371011&rnid=2224369011&s=pc&sr=1-591
"2020 Dell Inspiron 3000 15.6-inch HD Touchscreen Laptop PC, Intel 10th Gen Dual Core i3-1005G1 Processor, 8GB DDR4, 128GB SSD, 1TB HDD, Bluetooth, Windows 10, Black",http://www.amazon.com/Dell-3000-15-6-inch-Touchscreen-i3-1005G1/dp/B088K23635/ref=sr_1_592?dchild=1&keywords=laptop&qid=1634625386&refinements=p_n_condition-type%3A2224371011&rnid=2224369011&s=pc&sr=1-592
"2021 Newest Dell Business Laptop Latitude 3520, 15.6"" FHD IPS Backlit Display, i7-1165G7, 32GB RAM, 1TB SSD, Webcam, WiFi 6, USB-C, HDMI, Win 10 Pro",http://www.amazon.com/Dell-Business-Latitude-3520-i7-1165G7/dp/B09BP3QCS4/ref=sr_1_593?dchild=1&keywords=laptop&qid=1634625386&refinements=p_n_condition-type%3A2224371011&rnid=2224369011&s=pc&sr=1-593
"2021 Newest Dell Inspiron 14 7000 2-in-1 Touchscreen Business Laptop 14"" FHD, AMD Ryzen 5 4500U, 16G RAM 1TB SSD, Backlit Keyboard, Fingerprint Reader, WiFi 6, Window 10",http://www.amazon.com/Dell-Powerful-Hexa-Core-i7-10750H-Thunderbolt/dp/B08PNFWCPH/ref=sr_1_594?dchild=1&keywords=laptop&qid=1634625386&refinements=p_n_condition-type%3A2224371011&rnid=2224369011&s=pc&sr=1-594
"2021 Newest HP 15 15.6"" HD Display Laptop Computer, AMD Athlon Gold 3150U (up to 3.3GHz, Beat i3-8130U), 8GB DDR4 RAM, 256GB PCIe SSD, WiFi, Bluetooth, HDMI, Webcam, Remote Work, Win 10 S, AllyFlex MP",http://www.amazon.com/HP-15-Athlon-Gold-Bluetooth/dp/B08RCW9PNH/ref=sr_1_595?dchild=1&keywords=laptop&qid=1634625386&refinements=p_n_condition-type%3A2224371011&rnid=2224369011&s=pc&sr=1-595
"2020 HP Pavilion x360 14"" FHD WLED Touchscreen 2-in-1 Convertible Laptop, Intel Core i5-1035G1 up to 3.6GHz, 8GB DDR4, 256GB SSD, 802.11ac, Bluetooth, Webcam, HDMI, Fingerprint Reader, Windows 10",http://www.amazon.com/HP-Touchscreen-Convertible-i5-1035G1-Fingerprint/dp/B08B3X4L95/ref=sr_1_596?dchild=1&keywords=laptop&qid=1634625386&refinements=p_n_condition-type%3A2224371011&rnid=2224369011&s=pc&sr=1-596
"Acer Swift 3 Laptop, 14"" Full HD 1080p, AMD Ryzen 5 4500U Hexa-Core Processor, 8GB RAM, 256GB SSD, Fingerprint Reader, Back-lit Keyboard, Windows 10 Home, SF314-42-R0HP",http://www.amazon.com/Acer-Hexa-Core-Processor-Fingerprint-SF314-42-R0HP/dp/B08DFPK7R3/ref=sr_1_597?dchild=1&keywords=laptop&qid=1634625386&refinements=p_n_condition-type%3A2224371011&rnid=2224369011&s=pc&sr=1-597
"MSI GF75 Gaming Laptop: 17.3"" 144Hz FHD 1080p Display, Intel Core i5-10300H, NVIDIA GeForce GTX 1650 Ti, 16GB, 512GB SSD + 1TB HDD, Win10, Black (10SCSXR-619)",http://www.amazon.com/MSI-GF75-Gaming-Laptop-10SCSXR-619/dp/B0956LGDPB/ref=sr_1_598?dchild=1&keywords=laptop&qid=1634625386&refinements=p_n_condition-type%3A2224371011&rnid=2224369011&s=pc&sr=1-598
"HP 15.6"" Full HD Premium Laptop, AMD Ryzen 5-5500u Processor, 8GB DDR4, 256GB SSD, 802.11ac, Bluetooth , HDMI, Windows 10, W/ Silmarils Travel Accessories",http://www.amazon.com/HP-Processor-Bluetooth-Silmarils-Accessories/dp/B09GFT4SBW/ref=sr_1_599?dchild=1&keywords=laptop&qid=1634625386&refinements=p_n_condition-type%3A2224371011&rnid=2224369011&s=pc&sr=1-599
"2021 HP 15.6"" FHD IPS Screen Laptop PC Intel 11th Gen 4-Core i5-1135G7 12GB DDR4 RAM 256GB NVMe SSD Intel Iris Xe Graphics Webcam HDMI Fingerprint USB C Windows 10 Pro Silver w/RE 32GB USB 3.0 Drive",http://www.amazon.com/HP-Touchscreen-i7-1065G7-Quad-Core-Processor/dp/B08T5XTQV7/ref=sr_1_600?dchild=1&keywords=laptop&qid=1634625386&refinements=p_n_condition-type%3A2224371011&rnid=2224369011&s=pc&sr=1-600
"BMAX X15 Laptop Computers, 15.6"" FHD (1920 x 1080) Display, Intel 4120 up to 2.6 GHz, 8GB DDR4, 256GB SSD Storage, HDMI, Webcam, WI-FI, Windows 10 - Space Grey",http://www.amazon.com/X15-Computers-Display-Storage-Windows/dp/B08R8R56S1/ref=sr_1_601?dchild=1&keywords=laptop&qid=1634625389&refinements=p_n_condition-type%3A2224371011&rnid=2224369011&s=pc&sr=1-601
"HP 15-dy2132 15.6"" Touchscreen Laptop i3-1115G4 8GB RAM 256GB SSD Windows 10 Home in S Mode Silver",http://www.amazon.com/HP-15-dy2132-Touchscreen-i3-1115G4-Windows/dp/B09HSNLMD2/ref=sr_1_602?dchild=1&keywords=laptop&qid=1634625389&refinements=p_n_condition-type%3A2224371011&rnid=2224369011&s=pc&sr=1-602
"New HP Pavilion x360 2-in-1 14"" Touch-Screen Laptop, 11th Gen Intel Core i3-1115G4(Beat i5-1035G4),16GB 3200Mhz DDR4 RAM, 512GB SSD, Win10 H, 14m-dw1013dx, Natural Silver",http://www.amazon.com/HP-Touch-Screen-i3-1115G4-i5-1035G4-14m-dw1013dx/dp/B09GFJ13X6/ref=sr_1_603?dchild=1&keywords=laptop&qid=1634625389&refinements=p_n_condition-type%3A2224371011&rnid=2224369011&s=pc&sr=1-603
"HP 14 Series 14"" HD SVA BrightView WLED-Backlit Laptop, Intel 10th Gen Core i3-1005G1 up to 3.4GHz, 4GB DDR4, 128GB SSD, USB 3.1-C, Webcam, 802.11ac, Bluetooth, HDMI, Windows 10 Home in S Mode",http://www.amazon.com/HP-14-BrightView-WLED-Backlit-i3-1005G1/dp/B0814LGNBP/ref=sr_1_604?dchild=1&keywords=laptop&qid=1634625389&refinements=p_n_condition-type%3A2224371011&rnid=2224369011&s=pc&sr=1-604
"2021 Newest HP Pavilion X360 2-in-1 Convertible 14"" HD Touch-Screen Laptop, 10th Gen Intel Core i3-1005G1(Up to 3.4GHz, Beat i5-7200U), 8GB RAM, 128GB SSD, WiFi 5, Webcam, Windows 10 S + Oydisen Cloth",http://www.amazon.com/HP-Pavilion-Convertible-Touch-Screen-i3-1005G1/dp/B08F5KCLCR/ref=sr_1_605?dchild=1&keywords=laptop&qid=1634625389&refinements=p_n_condition-type%3A2224371011&rnid=2224369011&s=pc&sr=1-605
